B1: Группа | C1: Р - 4 | I1: Дата последней коррекции: | P1: 40283
B2: Предмет | C2: МПРО
B3: Вид отчетности | C3: Экзамен + курсовая | G3: Итоговый рейтинг
E6: 6 | F6: 30 | I6: max 60 | L6: max40 | O6: Экзамен + курсовая
C7: Текущий балл | J7: Автомат | P7: Вопросов | U7: Итоговая ОЦЕНКА
A8: № | B8: Ф.И.О. | C8: Лек. | D8: Курс. | E8: Блек | F8: Блаб | G8: Бкур | H8: Бдоп | I8: Бтек | J8: Авт | K8: Бавт | L8: ОБ(а) | M8: Оценка | O8: Бтек | P8: Доп | Q8: Отв | R8: Оценка | S8: Кол поп. | T8: ОБ
A9: 1 | B9: Казаков А.А. | C9: 8 | D9: 4 | E9: 13.333333333333334 | F9: 38.8 | G9: 8.2 | H9: 0 | I9: 60 | K9: ??? | L9: 60 | M9: 0 | O9: =I9 -> 60 | Q9: - | T9: 55.333333333333329
A10: 2 | B10: Казанцев В.М. | C10: 0 | D10: 0 | E10: 0 | F10: 7.8 | G10: 0 | H10: 0 | I10: 7.8 | K10: 0 | L10: 7.8 | M10: 0 | O10: =I10 -> 7.8 | P10: 9 | Q10: 0 | R10: - | U10: Н/Д (лек)
A11: 3 | B11: Клюжев М.С. | C11: 6 | D11: 0 | E11: 10 | F11: 29.6 | G11: 0 | H11: 0 | I11: 39.6 | K11: 0 | L11: 39.6 | M11: 0 | O11: =I11 -> 39.6 | Q11: - | R11: - | U11: Неатест.
A12: 4 | B12: Коршунов И.А. | C12: 7 | D12: 0 | E12: 11.666666666666668 | F12: 29 | G12: 0 | H12: 0 | I12: 40.666666666666671 | K12: 0 | L12: 40.666666666666671 | M12: 0 | O12: =I12 -> 40.666666666666671 | Q12: - | R12: - | U12: Н/Д (курс)
A13: 5 | B13: Кудряшов С.П. | C13: 0 | D13: 0 | E13: 0 | F13: 13.4 | G13: 0 | H13: 0 | I13: 13.4 | K13: 0 | L13: 13.4 | M13: 0 | O13: =I13 -> 13.4 | P13: 9 | Q13: 0 | R13: - | U13: Н/Д (лек)
A14: 6 | B14: Макарычев М.М. | C14: 6 | D14: 0 | E14: 10 | F14: 27.6 | G14: 0 | H14: 0 | I14: 37.6 | K14: 0 | L14: 37.6 | M14: 0 | O14: =I14 -> 37.6 | Q14: - | R14: - | U14: Неатест.
A15: 7 | B15: Новичков А.С. | C15: 6 | D15: 0 | E15: 10 | F15: 38.8 | G15: 0 | H15: 0 | I15: 48.8 | K15: 0 | L15: 48.8 | M15: 0 | O15: =I15 -> 48.8 | Q15: - | R15: - | U15: Неатест.
A16: 8 | B16: Нозадзе Г.К. | C16: 6 | D16: 0 | E16: 10 | F16: 4 | G16: 0 | H16: 0 | I16: 14 | K16: 0 | L16: 14 | M16: 0 | O16: =I16 -> 14 | Q16: - | R16: - | U16: Неатест.
A17: 9 | B17: Рябов А.А. | C17: 2 | D17: 0 | E17: 3.3333333333333335 | F17: 7.8 | G17: 0 | H17: 0 | I17: 11.133333333333333 | K17: 0 | L17: 11.133333333333333 | M17: 0 | O17: =I17 -> 11.133333333333333 | P17: 7 | Q17: 0 | R17: - | U17: Н/Д (лек)
A18: 10 | B18: Сидоров А.С. | C18: 9 | D18: 0 | E18: 15 | F18: 28.2 | G18: 0 | H18: 0 | I18: 43.2 | K18: 0 | L18: 43.2 | M18: 0 | O18: =I18 -> 43.2 | Q18: - | R18: - | U18: Н/Д (курс)
A19: 11 | B19: Шибаев А.М. | C19: 5 | D19: 0 | E19: 8.3333333333333339 | F19: 13.4 | G19: 0 | H19: 0 | I19: 21.733333333333334 | K19: 0 | L19: 21.733333333333334 | M19: 0 | O19: =I19 -> 21.733333333333334 | Q19: - | R19: - | U19: Неатест.
A20: 12 | C20: 0 | D20: 0 | E20: 0 | F20: 0 | G20: 0 | H20: 0 | I20: 0 | K20: 0 | L20: 0 | M20: 0 | O20: =I20 -> 0
A21: 13 | B21: Березин П.Ю. | C21: 9 | D21: 0 | E21: 15 | F21: 25 | G21: 0 | H21: 0 | I21: 40 | K21: 0 | L21: 40 | M21: 0 | O21: =I21 -> 40 | Q21: - | R21: - | U21: Н/Д (курс)
A22: 14 | B22: Бершов А.О. | C22: 6 | D22: 0 | E22: 10 | F22: 20.2 | G22: 0 | H22: 0 | I22: 30.2 | K22: 0 | L22: 30.2 | M22: 0 | O22: =I22 -> 30.2 | Q22: - | R22: - | U22: Неатест.
A23: 15 | B23: Болдин Л.О. | C23: 9 | D23: 0 | E23: 15 | F23: 32 | G23: 0 | H23: 0 | I23: 47 | K23: 0 | L23: 47 | M23: 0 | O23: =I23 -> 47 | Q23: - | R23: - | U23: Н/Д (курс)
A24: 16 | B24: Заболотный В.В. | C24: 9 | D24: 0 | E24: 15 | F24: 33.2 | G24: 0 | H24: 0 | I24: 48.2 | K24: 0 | L24: 48.2 | M24: 0 | O24: =I24 -> 48.2 | Q24: - | R24: - | U24: Н/Д (курс)
A25: 17 | B25: Зуев А.А. | C25: 7 | D25: 0 | E25: 11.666666666666668 | F25: 17.6 | G25: 0 | H25: 0 | I25: 29.266666666666669 | K25: 0 | L25: 29.266666666666669 | M25: 0 | O25: =I25 -> 29.266666666666669 | Q25: - | R25: - | U25: Неатест.
A26: 18 | B26: Кабанин Д.В. | C26: 8 | D26: 0 | E26: 13.333333333333334 | F26: 23.2 | G26: 0 | H26: 0 | I26: 36.533333333333331 | K26: 0 | L26: 36.533333333333331 | M26: 0 | O26: =I26 -> 36.533333333333331 | Q26: - | R26: - | U26: Неатест.
A27: 19 | B27: Кабанов Д.Г. | C27: 7 | D27: 0 | E27: 11.666666666666668 | F27: 44.4 | G27: 0 | H27: 0 | I27: 56.066666666666663 | K27: 0 | L27: 56.066666666666663 | M27: 0 | O27: =I27 -> 56.066666666666663 | Q27: - | R27: - | U27: Н/Д (курс)
A28: 20 | B28: Кокурин А.Н. | C28: 3 | D28: 0 | E28: 5 | F28: 42 | G28: 0 | H28: 0 | I28: 47 | K28: 0 | L28: 47 | M28: 0 | O28: =I28 -> 47 | P28: 6 | Q28: 0 | R28: - | U28: Н/Д (лек)
A29: 21 | B29: Колпаков С.А. | C29: 9 | D29: 0 | E29: 15 | F29: 34.4 | G29: 0 | H29: 0 | I29: 49.4 | K29: 0 | L29: 49.4 | M29: 0 | O29: =I29 -> 49.4 | Q29: - | R29: - | U29: Н/Д (курс)
A30: 22 | B30: Макаров А.Ю. | C30: 8 | D30: 0 | E30: 13.333333333333334 | F30: 35.8 | G30: 0 | H30: 0 | I30: 49.133333333333333 | K30: 0 | L30: 49.133333333333333 | M30: 0 | O30: =I30 -> 49.133333333333333 | Q30: - | R30: - | U30: Неатест.
A31: 23 | B31: Никулин О.Ю. | C31: 9 | D31: 0 | E31: 15 | F31: 34.4 | G31: 0 | H31: 0 | I31: 49.4 | K31: 0 | L31: 49.4 | M31: 0 | O31: =I31 -> 49.4 | Q31: - | R31: - | U31: Н/Д (курс)
A32: 24 | B32: Овчинников О.И. | C32: 9 | D32: 0 | E32: 15 | F32: 24.4 | G32: 0 | H32: 0 | I32: 39.4 | K32: 0 | L32: 39.4 | M32: 0 | O32: =I32 -> 39.4 | Q32: - | R32: - | U32: Неатест.
A33: 25 | B33: Пушкарев Д.В. | C33: 8 | D33: 0 | E33: 13.333333333333334 | F33: 18.2 | G33: 0 | H33: 0 | I33: 31.533333333333331 | K33: 0 | L33: 31.533333333333331 | M33: 0 | O33: =I33 -> 31.533333333333331 | Q33: - | R33: - | U33: Неатест.
A34: 26 | B34: Шокин Д.А. | C34: 9 | D34: 0 | E34: 15 | F34: 16.4 | G34: 0 | H34: 0 | I34: 31.4 | K34: 0 | L34: 31.4 | M34: 0 | O34: =I34 -> 31.4 | Q34: - | R34: - | U34: Неатест.
A35: 27 | C35: 0 | D35: 0 | E35: 0 | F35: 0 | G35: 0 | H35: 0 | I35: 0 | K35: 0 | L35: 0 | M35: 0 | O35: =I35 -> 0
A36: 28 | B36: Баринов А.Е. | C36: 9 | D36: 0 | E36: 15 | F36: 28.2 | G36: 0 | H36: 0 | I36: 43.2 | K36: 0 | L36: 43.2 | M36: 0 | O36: =I36 -> 43.2 | Q36: - | R36: - | U36: Н/Д (курс)
A37: 29 | B37: Волков А.В. | C37: 8 | D37: 0 | E37: 13.333333333333334 | F37: 17.6 | G37: 0 | H37: 0 | I37: 30.933333333333337 | K37: 0 | L37: 30.933333333333337 | M37: 0 | O37: =I37 -> 30.933333333333337 | Q37: - | R37: - | U37: Неатест.
A38: 30 | B38: Гора Г.А. | C38: 7 | D38: 0 | E38: 11.666666666666668 | F38: 27 | G38: 0 | H38: 0 | I38: 38.666666666666671 | K38: 0 | L38: 38.666666666666671 | M38: 0 | O38: =I38 -> 38.666666666666671 | Q38: - | R38: - | U38: Неатест.
A39: 31 | B39: Груздев С.М. | C39: 8 | D39: 0 | E39: 13.333333333333334 | F39: 30 | G39: 0 | H39: 0 | I39: 43.333333333333336 | K39: 0 | L39: 43.333333333333336 | M39: 0 | O39: =I39 -> 43.333333333333336 | Q39: - | R39: - | U39: Н/Д (курс)
A40: 32 | B40: Дудин В.М. | C40: 7 | D40: 0 | E40: 11.666666666666668 | F40: 20.8 | G40: 0 | H40: 0 | I40: 32.466666666666669 | K40: 0 | L40: 32.466666666666669 | M40: 0 | O40: =I40 -> 32.466666666666669 | Q40: - | R40: - | U40: Неатест.
A41: 33 | B41: Кузичкин А.В. | C41: 9 | D41: 0 | E41: 15 | F41: 17 | G41: 0 | H41: 0 | I41: 32 | K41: 0 | L41: 32 | M41: 0 | O41: =I41 -> 32 | Q41: - | R41: - | U41: Неатест.
A42: 34 | B42: Отдельнов А.А. | C42: 9 | D42: 0 | E42: 15 | F42: 18.8 | G42: 0 | H42: 0 | I42: 33.8 | K42: 0 | L42: 33.8 | M42: 0 | O42: =I42 -> 33.8 | Q42: - | R42: - | U42: Неатест.
A43: 35 | B43: Рыбаков О.Ю. | C43: 5 | D43: 0 | E43: 8.3333333333333339 | F43: 17 | G43: 0 | H43: 0 | I43: 25.333333333333336 | K43: 0 | L43: 25.333333333333336 | M43: 0 | O43: =I43 -> 25.333333333333336 | Q43: - | R43: - | U43: Неатест.
A44: 36 | B44: Шакиров И.А. | C44: 8 | D44: 0 | E44: 13.333333333333334 | F44: 5.4 | G44: 0 | H44: 0 | I44: 18.733333333333334 | K44: 0 | L44: 18.733333333333334 | M44: 0 | O44: =I44 -> 18.733333333333334 | Q44: - | R44: - | U44: Неатест.
A45: 37 | B45: Шибаев А.И. | C45: 3 | D45: 0 | E45: 5 | F45: 7.8 | G45: 0 | H45: 0 | I45: 12.8 | K45: 0 | L45: 12.8 | M45: 0 | O45: =I45 -> 12.8 | P45: 6 | Q45: 0 | R45: - | U45: Н/Д (лек)