B1: Группа | C1: ЭМ-42 | I1: Дата последней коррекции: | P1: 40284
B2: Предмет | C2: ДССАУ
B3: Вид отчетности | C3: Зачет | G3: Итоговый рейтинг
E6: 6 | F6: 30 | I6: max 60 | L6: max40 | O6: Зачет
C7: Текущий балл | J7: Автомат | P7: Вопросов | U7: Итоговая ОЦЕНКА
A8: № | B8: Ф.И.О. | C8: Лек. | D8: Курс. | E8: Блек | F8: Блаб | G8: Бкур | H8: Бдоп | I8: Бтек | J8: Авт | K8: Бавт | L8: ОБ(а) | M8: Оценка | O8: Бтек | P8: Доп | Q8: Отв | R8: Оценка | S8: Кол поп. | T8: ОБ
A9: 1 | B9: Бутылин Павел Николаевич | C9: 7 | D9: 0 | E9: 7.5 | F9: 36.4 | G9: 0 | H9: 0 | I9: 43.9 | J9: А | K9: ??? | L9: 43.9 | M9: Н/Д(конт) | O9: =I9 -> 43.9 | Q9: - | R9: - | U9: Н/Д(конт)
A10: 2 | B10: Варакин Денис Владимирович | C10: 11 | D10: 0 | E10: 11.785714285714285 | F10: 40.6 | G10: 0 | H10: 0 | I10: 52.385714285714286 | J10: А | K10: 13.5 | L10: 65.885714285714286 | M10: Незачет | O10: =I10 -> 52.385714285714286 | Q10: - | R10: - | U10: Незачет
A11: 3 | B11: Волостнов Иван Владимирович | C11: 11 | D11: 0 | E11: 11.785714285714285 | F11: 46.6 | G11: 0 | H11: 0 | I11: 58.385714285714286 | J11: А | K11: 13.5 | L11: 71.885714285714286 | M11: Зачет | O11: =I11 -> 58.385714285714286 | Q11: - | R11: - | U11: Зачет
A12: 4 | B12: Карюхин Алексей Юрьевич | C12: 11 | D12: 0 | E12: 11.785714285714285 | F12: 13.7 | G12: 0 | H12: 0 | I12: 25.485714285714284 | J12: А | K12: ??? | L12: 25.485714285714284 | M12: Неатест. | O12: =I12 -> 25.485714285714284 | Q12: - | R12: - | U12: Неатест.
A13: 5 | B13: Копейкин Дмитрий Иванович | C13: 9 | D13: 0 | E13: 9.6428571428571423 | F13: 37.9 | G13: 0 | H13: 0 | I13: 47.542857142857144 | J13: А | K13: ??? | L13: 47.542857142857144 | M13: Н/Д(конт) | O13: =I13 -> 47.542857142857144 | Q13: - | R13: - | U13: Н/Д(конт)
A14: 6 | B14: Тарханов Сергей Евгеньевич | C14: 11 | D14: 0 | E14: 11.785714285714285 | F14: 36.4 | G14: 0 | H14: 0 | I14: 48.185714285714283 | J14: А | K14: 13.5 | L14: 61.685714285714283 | M14: Незачет | O14: =I14 -> 48.185714285714283 | Q14: - | R14: - | U14: Незачет
A15: 7 | B15: Трянин Денис Валерьевич | C15: 0 | D15: 0 | E15: 0 | F15: 0 | G15: 0 | H15: 0 | I15: 0 | J15: А | K15: 0 | L15: 0 | M15: Неатест. | O15: =I15 -> 0 | P15: 14 | R15: - | U15: Неатест.
A16: 8 | B16: Шепетов Николай Андреевич | C16: 9 | D16: 0 | E16: 9.6428571428571423 | F16: 36.4 | G16: 0 | H16: 0 | I16: 46.042857142857144 | J16: А | K16: 13.5 | L16: 59.542857142857144 | M16: Незачет | O16: =I16 -> 46.042857142857144 | Q16: - | R16: - | U16: Незачет
A17: 9 | C17: 0 | D17: 0 | E17: 0 | F17: 0 | G17: 0 | H17: 0 | I17: 0 | J17: А | K17: 0 | L17: 0 | M17: 0 | O17: =I17 -> 0
A18: 10 | B18: Залетнев Сергей Анатольевич | C18: 4 | D18: 0 | E18: 4.2857142857142856 | F18: 5 | G18: 0 | H18: 0 | I18: 9.2857142857142847 | J18: А | K18: 10.5 | L18: 19.785714285714285 | M18: Неатест. | O18: =I18 -> 9.2857142857142847 | P18: 10 | R18: - | U18: Неатест.
A19: 11 | B19: Казаков Денис Александрович | C19: 10 | D19: 0 | E19: 10.714285714285714 | F19: 41.2 | G19: 0 | H19: 0 | I19: 51.914285714285718 | J19: А | K19: 10.5 | L19: 62.414285714285718 | M19: Незачет | O19: =I19 -> 51.914285714285718 | Q19: - | R19: - | U19: Незачет
A20: 12 | B20: Комлев Иван Владимирович | C20: 8 | D20: 0 | E20: 8.5714285714285712 | F20: 13.7 | G20: 0 | H20: 0 | I20: 22.271428571428572 | J20: А | K20: ??? | L20: 22.271428571428572 | M20: Неатест. | O20: =I20 -> 22.271428571428572 | Q20: - | R20: - | U20: Неатест.
A21: 13 | B21: Кузнецов Артем Александрович | C21: 0 | D21: 0 | E21: 0 | F21: 0 | G21: 0 | H21: 0 | I21: 0 | J21: А | K21: 0 | L21: 0 | M21: Неатест. | O21: =I21 -> 0 | P21: 14 | R21: - | U21: Неатест.
A22: 14 | B22: Мартынов Дмитрий Сергеевич | C22: 0 | D22: 0 | E22: 0 | F22: 0 | G22: 0 | H22: 0 | I22: 0 | J22: А | K22: 0 | L22: 0 | M22: Неатест. | O22: =I22 -> 0 | P22: 14 | R22: - | U22: Неатест.
A23: 15 | B23: Отекин Алексей Владимирович | C23: 4 | D23: 0 | E23: 4.2857142857142856 | F23: 5 | G23: 0 | H23: 0 | I23: 9.2857142857142847 | J23: А | K23: 0 | L23: 9.2857142857142847 | M23: Неатест. | O23: =I23 -> 9.2857142857142847 | P23: 10 | R23: - | U23: Неатест.
A24: 16 | B24: Сазанов Роман Сергеевич | C24: 6 | D24: 0 | E24: 6.4285714285714288 | F24: 5 | G24: 0 | H24: 0 | I24: 11.428571428571429 | J24: А | K24: ??? | L24: 11.428571428571429 | M24: Неатест. | O24: =I24 -> 11.428571428571429 | Q24: - | R24: - | U24: Неатест.
A25: 17 | B25: Соловьев Александр Геннадьевич | C25: 9 | D25: 0 | E25: 9.6428571428571423 | F25: 5 | G25: 0 | H25: 0 | I25: 14.642857142857142 | J25: А | K25: ??? | L25: 14.642857142857142 | M25: Неатест. | O25: =I25 -> 14.642857142857142 | Q25: - | R25: - | U25: Неатест.
A26: 18 | B26: Стрельченко Алексей Юрьевич | C26: 10 | D26: 0 | E26: 10.714285714285714 | F26: 5 | G26: 0 | H26: 0 | I26: 15.714285714285714 | J26: А | K26: 10.5 | L26: 26.214285714285715 | M26: Неатест. | O26: =I26 -> 15.714285714285714 | Q26: - | R26: - | U26: Неатест.
A27: 19 | B27: Терехин Денис Владимирович | C27: 10 | D27: 0 | E27: 10.714285714285714 | F27: 55.9 | G27: 0 | H27: 0 | I27: 60 | J27: А | K27: 10.5 | L27: 70.5 | M27: Зачет | O27: =I27 -> 60 | Q27: - | R27: - | U27: Зачет