B1: Группа | C1: ЭМ-41 | I1: Дата последней коррекции: | P1: 40284
B2: Предмет | C2: ДССАУ
B3: Вид отчетности | C3: Зачет | G3: Итоговый рейтинг
E6: 6 | F6: 30 | I6: max 60 | L6: max40 | O6: Зачет
C7: Текущий балл | J7: Автомат | P7: Вопросов | U7: Итоговая ОЦЕНКА
A8: № | B8: Ф.И.О. | C8: Лек. | D8: Курс. | E8: Блек | F8: Блаб | G8: Бкур | H8: Бдоп | I8: Бтек | J8: Авт | K8: Бавт | L8: ОБ(а) | M8: Оценка | O8: Бтек | P8: Доп | Q8: Отв | R8: Оценка | S8: Кол поп. | T8: ОБ
A9: 1 | B9: Волков Олег Сергеевич | C9: 8 | D9: 0 | E9: 8.5714285714285712 | F9: 5 | G9: 0 | H9: 0 | I9: 13.571428571428571 | J9: А | K9: 13.5 | L9: 27.071428571428569 | M9: Неатест. | O9: =I9 -> 13.571428571428571 | Q9: - | R9: - | U9: Неатест.
A10: 2 | B10: Захаров Николай Константинович | C10: 9 | D10: 0 | E10: 9.6428571428571423 | F10: 5 | G10: 0 | H10: 0 | I10: 14.642857142857142 | J10: А | K10: ??? | L10: 14.642857142857142 | M10: Неатест. | O10: =I10 -> 14.642857142857142 | Q10: - | R10: - | U10: Неатест.
A11: 3 | B11: Исаков Виктор Андреевич | C11: 0 | D11: 0 | E11: 0 | F11: 0 | G11: 0 | H11: 0 | I11: 0 | J11: А | K11: 0 | L11: 0 | M11: Неатест. | O11: =I11 -> 0 | P11: 14 | R11: - | U11: Неатест.
A12: 4 | B12: Коновалов Илья Сергеевич | C12: 7 | D12: 0 | E12: 7.5 | F12: 0 | G12: 0 | H12: 0 | I12: 7.5 | J12: А | K12: ??? | L12: 7.5 | M12: Неатест. | O12: =I12 -> 7.5 | Q12: - | R12: - | U12: Неатест.
A13: 5 | B13: Макаев Алексей Сергеевич | C13: 9 | D13: 0 | E13: 9.6428571428571423 | F13: 0 | G13: 0 | H13: 0 | I13: 9.6428571428571423 | J13: А | K13: ??? | L13: 9.6428571428571423 | M13: Неатест. | O13: =I13 -> 9.6428571428571423 | Q13: - | R13: - | U13: Неатест.
A14: 6 | B14: Макаров Роман Игоревич | C14: 11 | D14: 0 | E14: 11.785714285714285 | F14: 5 | G14: 0 | H14: 0 | I14: 16.785714285714285 | J14: А | K14: ??? | L14: 16.785714285714285 | M14: Неатест. | O14: =I14 -> 16.785714285714285 | Q14: - | R14: - | U14: Неатест.
A15: 7 | B15: Мигунов Анатолий Николаевич | C15: 4 | D15: 0 | E15: 4.2857142857142856 | F15: 5 | G15: 0 | H15: 0 | I15: 9.2857142857142847 | J15: А | K15: 13.5 | L15: 22.785714285714285 | M15: Неатест. | O15: =I15 -> 9.2857142857142847 | P15: 10 | R15: - | U15: Неатест.
A16: 8 | B16: Никулин Алексей Евгеньевич | C16: 7 | D16: 0 | E16: 7.5 | F16: 5 | G16: 0 | H16: 0 | I16: 12.5 | J16: А | K16: ??? | L16: 12.5 | M16: Неатест. | O16: =I16 -> 12.5 | Q16: - | R16: - | U16: Неатест.
A17: 9 | B17: Плахин Сергей Николаевич | C17: 10 | D17: 0 | E17: 10.714285714285714 | F17: 65.8 | G17: 0 | H17: 5 | I17: 60 | J17: А | K17: 10.5 | L17: 70.5 | M17: Зачет | O17: =I17 -> 60 | Q17: - | R17: - | U17: Зачет
A18: 10 | B18: Поздеев Роман Александрович | C18: 7 | D18: 0 | E18: 7.5 | F18: 5 | G18: 0 | H18: 0 | I18: 12.5 | J18: А | K18: 13.5 | L18: 26 | M18: Неатест. | O18: =I18 -> 12.5 | Q18: - | R18: - | U18: Неатест.
A19: 11 | B19: Разуванов Михаил Евгеньевич | C19: 2 | D19: 0 | E19: 2.1428571428571428 | F19: 0 | G19: 0 | H19: 0 | I19: 2.1428571428571428 | J19: А | K19: 0 | L19: 2.1428571428571428 | M19: Неатест. | O19: =I19 -> 2.1428571428571428 | P19: 12 | R19: - | U19: Неатест.
A20: 12 | B20: Рыбин Максим Павлович | C20: 9 | D20: 0 | E20: 9.6428571428571423 | F20: 5 | G20: 0 | H20: 0 | I20: 14.642857142857142 | J20: А | K20: ??? | L20: 14.642857142857142 | M20: Неатест. | O20: =I20 -> 14.642857142857142 | Q20: - | R20: - | U20: Неатест.
A21: 13 | B21: Рыжов Максим Александрович | C21: 0 | D21: 0 | E21: 0 | F21: 0 | G21: 0 | H21: 0 | I21: 0 | J21: А | K21: 0 | L21: 0 | M21: Неатест. | O21: =I21 -> 0 | P21: 14 | R21: - | U21: Неатест.
A22: 14 | B22: Рябинкин Дмитрий Олегович | C22: 8 | D22: 0 | E22: 8.5714285714285712 | F22: 5 | G22: 0 | H22: 0 | I22: 13.571428571428571 | J22: А | K22: ??? | L22: 13.571428571428571 | M22: Неатест. | O22: =I22 -> 13.571428571428571 | Q22: - | R22: - | U22: Неатест.
A23: 15 | B23: Рязанцев Антон Юрьевич | C23: 6 | D23: 0 | E23: 6.4285714285714288 | F23: 5 | G23: 0 | H23: 0 | I23: 11.428571428571429 | J23: А | K23: ??? | L23: 11.428571428571429 | M23: Неатест. | O23: =I23 -> 11.428571428571429 | Q23: - | R23: - | U23: Неатест.
A24: 16 | B24: Сонин Сергей Александрович | C24: 0 | D24: 0 | E24: 0 | F24: 0 | G24: 0 | H24: 0 | I24: 0 | J24: А | K24: 0 | L24: 0 | M24: Неатест. | O24: =I24 -> 0 | P24: 14 | R24: - | U24: Неатест.
A25: 17 | B25: Ямщиков Андрей Александрвович | C25: 10 | D25: 0 | E25: 10.714285714285714 | F25: 37.3 | G25: 0 | H25: 0 | I25: 48.014285714285712 | J25: А | K25: 13.5 | L25: 61.514285714285712 | M25: Незачет | O25: =I25 -> 48.014285714285712 | Q25: - | R25: - | U25: Незачет
A26: 18 | B26: Телицын Евгений Владимирович | C26: 10 | D26: 0 | E26: 10.714285714285714 | F26: 5 | G26: 0 | H26: 0 | I26: 15.714285714285714 | J26: А | K26: ??? | L26: 15.714285714285714 | M26: Неатест. | O26: =I26 -> 15.714285714285714 | Q26: - | R26: - | U26: Неатест.
A27: 19 | C27: 0 | D27: 0 | E27: 0 | F27: 0 | G27: 0 | H27: 0 | I27: 0 | J27: А | K27: 0 | L27: 0 | M27: 0 | O27: =I27 -> 0
A28: 20 | B28: Бородавин Юрий Викторович | C28: 10 | D28: 0 | E28: 10.714285714285714 | F28: 40.6 | G28: 0 | H28: 0 | I28: 51.314285714285717 | J28: А | K28: ??? | L28: 51.314285714285717 | M28: Н/Д(конт) | O28: =I28 -> 51.314285714285717 | Q28: - | R28: - | U28: Н/Д(конт)
A29: 21 | B29: Бородин Александр Валерьевич | C29: 10 | D29: 0 | E29: 10.714285714285714 | F29: 55.9 | G29: 0 | H29: 0 | I29: 60 | J29: А | K29: 13.5 | L29: 73.5 | M29: Зачет | O29: =I29 -> 60 | Q29: - | R29: - | U29: Зачет
A30: 22 | B30: Воронцов Сергей Михайлович | C30: 10 | D30: 0 | E30: 10.714285714285714 | F30: 86.8 | G30: 0 | H30: 0 | I30: 60 | J30: А | K30: 10.5 | L30: 70.5 | M30: Зачет | O30: =I30 -> 60 | Q30: - | R30: - | U30: Зачет
A31: 23 | B31: Дробилов Александр Валентинович | C31: 7 | D31: 0 | E31: 7.5 | F31: 13.7 | G31: 0 | H31: 0 | I31: 21.2 | J31: А | K31: 10.5 | L31: 31.7 | M31: Неатест. | O31: =I31 -> 21.2 | Q31: - | R31: - | U31: Неатест.
A32: 24 | B32: Егоров Денис Вадимович | C32: 6 | D32: 0 | E32: 6.4285714285714288 | F32: 5 | G32: 0 | H32: 0 | I32: 11.428571428571429 | J32: А | K32: ??? | L32: 11.428571428571429 | M32: Неатест. | O32: =I32 -> 11.428571428571429 | Q32: - | R32: - | U32: Неатест.
A33: 25 | B33: Кибирев Александр Алексеевич | C33: 7 | D33: 0 | E33: 7.5 | F33: 0 | G33: 0 | H33: 2 | I33: 9.5 | J33: А | K33: ??? | L33: 9.5 | M33: Неатест. | O33: =I33 -> 9.5 | Q33: - | R33: - | U33: Неатест.
A34: 26 | B34: Ковалев Олег Анатольевич | C34: 6 | D34: 0 | E34: 6.4285714285714288 | F34: 5 | G34: 0 | H34: 0 | I34: 11.428571428571429 | J34: А | K34: ??? | L34: 11.428571428571429 | M34: Неатест. | O34: =I34 -> 11.428571428571429 | Q34: - | R34: - | U34: Неатест.
A35: 27 | B35: Кожухов Евгений Андреевич | C35: 0 | D35: 0 | E35: 0 | F35: 0 | G35: 0 | H35: 0 | I35: 0 | J35: А | K35: 0 | L35: 0 | M35: Неатест. | O35: =I35 -> 0 | P35: 14 | R35: - | U35: Неатест.
A36: 28 | B36: Кочнев Владимир Николаевич | C36: 11 | D36: 0 | E36: 11.785714285714285 | F36: 50.8 | G36: 0 | H36: 4 | I36: 60 | J36: А | K36: 13.5 | L36: 73.5 | M36: Зачет | O36: =I36 -> 60 | Q36: - | R36: - | U36: Зачет
A37: 29 | B37: Полушков Михаил Владимирович | C37: 11 | D37: 0 | E37: 11.785714285714285 | F37: 25.6 | G37: 0 | H37: 2 | I37: 39.385714285714286 | J37: А | K37: 10.5 | L37: 49.885714285714286 | M37: Неатест. | O37: =I37 -> 39.385714285714286 | Q37: - | R37: - | U37: Неатест.
A38: 30 | B38: Резухин Александр Игоревич | C38: 9 | D38: 0 | E38: 9.6428571428571423 | F38: 5 | G38: 0 | H38: 0 | I38: 14.642857142857142 | J38: А | K38: ??? | L38: 14.642857142857142 | M38: Неатест. | O38: =I38 -> 14.642857142857142 | Q38: - | R38: - | U38: Неатест.
A39: 31 | B39: Шалин Алексей Геннадьевич | C39: 0 | D39: 0 | E39: 0 | F39: 0 | G39: 0 | H39: 0 | I39: 0 | J39: А | K39: 0 | L39: 0 | M39: Неатест. | O39: =I39 -> 0 | P39: 14 | R39: - | U39: Неатест.
A40: 32 | B40: Лапшин С.Н | C40: 1 | D40: 0 | E40: 1.0714285714285714 | F40: 0 | G40: 0 | H40: 0 | I40: 1.0714285714285714 | J40: А | K40: 0 | L40: 1.0714285714285714 | M40: Неатест. | O40: =I40 -> 1.0714285714285714 | P40: 13 | R40: - | U40: Неатест.