B1: Группа | C1: ЭМ-41 | I1: Дата последней коррекции: | P1: 40284
B2: Предмет | C2: ТАПЭС
B3: Вид отчетности | C3: Зачет | G3: Итоговый рейтинг
E6: 10 | F6: 40 | I6: max 60 | L6: max40 | O6: Зачет
C7: Текущий балл | J7: Автомат | P7: Вопросов | U7: Итоговая ОЦЕНКА
A8: № | B8: Ф.И.О. | C8: Лек. | D8: Курс. | E8: Блек | F8: Блаб | G8: Бкур | H8: Бдоп | I8: Бтек | J8: Авт | K8: Бавт | L8: ОБ(а) | M8: Оценка | O8: Бтек | P8: Доп | Q8: Отв | R8: Оценка | S8: Кол поп. | T8: ОБ
A9: 1 | B9: Волков Олег Сергеевич | C9: 5 | D9: 0 | E9: 8.3333333333333339 | F9: 20 | G9: 0 | H9: 0 | I9: 28.333333333333336 | J9: А | K9: 0 | L9: 28.333333333333336 | M9: 0 | O9: =I9 -> 28.333333333333336 | P9: 4 | R9: - | U9: Неатест.
A10: 2 | B10: Захаров Николай Константинович | C10: 7 | D10: 0 | E10: 11.666666666666668 | F10: 20 | G10: 0 | H10: 0 | I10: 31.666666666666668 | J10: А | K10: ??? | L10: 31.666666666666668 | M10: 0 | O10: =I10 -> 31.666666666666668 | Q10: - | R10: - | U10: Неатест.
A11: 3 | B11: Исаков Виктор Андреевич | C11: 0 | D11: 0 | E11: 0 | F11: 0 | G11: 0 | H11: 0 | I11: 0 | J11: А | K11: 0 | L11: 0 | M11: 0 | O11: =I11 -> 0 | P11: 9 | R11: - | U11: Неатест.
A12: 4 | B12: Коновалов Илья Сергеевич | C12: 6 | D12: 0 | E12: 10 | F12: 8 | G12: 0 | H12: 0 | I12: 18 | J12: А | K12: ??? | L12: 18 | M12: 0 | O12: =I12 -> 18 | Q12: - | R12: - | U12: Неатест.
A13: 5 | B13: Макаев Алексей Сергеевич | C13: 5 | D13: 0 | E13: 8.3333333333333339 | F13: 14 | G13: 0 | H13: 0 | I13: 22.333333333333336 | J13: А | K13: 0 | L13: 22.333333333333336 | M13: 0 | O13: =I13 -> 22.333333333333336 | P13: 4 | R13: - | U13: Неатест.
A14: 6 | B14: Макаров Роман Игоревич | C14: 7 | D14: 0 | E14: 11.666666666666668 | F14: 30 | G14: 0 | H14: 0 | I14: 41.666666666666671 | J14: А | K14: ??? | L14: 41.666666666666671 | M14: 0 | O14: =I14 -> 41.666666666666671 | Q14: - | R14: - | U14: Н/Д(конт)
A15: 7 | B15: Мигунов Анатолий Николаевич | C15: 3 | D15: 0 | E15: 5 | F15: 20 | G15: 0 | H15: 0 | I15: 25 | J15: А | K15: 0 | L15: 25 | M15: 0 | O15: =I15 -> 25 | P15: 6 | R15: - | U15: Неатест.
A16: 8 | B16: Никулин Алексей Евгеньевич | C16: 6 | D16: 0 | E16: 10 | F16: 20 | G16: 0 | H16: 0 | I16: 30 | J16: А | K16: ??? | L16: 30 | M16: 0 | O16: =I16 -> 30 | Q16: - | R16: - | U16: Неатест.
A17: 9 | B17: Плахин Сергей Николаевич | C17: 6 | D17: 0 | E17: 10 | F17: 40 | G17: 0 | H17: 0 | I17: 50 | J17: А | K17: 15 | L17: 65 | M17: 0 | O17: =I17 -> 50 | Q17: - | R17: - | U17: Зачет
A18: 10 | B18: Поздеев Роман Александрович | C18: 3 | D18: 0 | E18: 5 | F18: 14 | G18: 0 | H18: 0 | I18: 19 | J18: А | K18: 0 | L18: 19 | M18: 0 | O18: =I18 -> 19 | P18: 6 | R18: - | U18: Неатест.
A19: 11 | B19: Разуванов Михаил Евгеньевич | C19: 2 | D19: 0 | E19: 3.3333333333333335 | F19: 14 | G19: 0 | H19: 0 | I19: 17.333333333333332 | J19: А | K19: 0 | L19: 17.333333333333332 | M19: 0 | O19: =I19 -> 17.333333333333332 | P19: 7 | R19: - | U19: Неатест.
A20: 12 | B20: Рыбин Максим Павлович | C20: 6 | D20: 0 | E20: 10 | F20: 20 | G20: 0 | H20: 0 | I20: 30 | J20: А | K20: ??? | L20: 30 | M20: 0 | O20: =I20 -> 30 | Q20: - | R20: - | U20: Неатест.
A21: 13 | B21: Рыжов Максим Александрович | C21: 0 | D21: 0 | E21: 0 | F21: 0 | G21: 0 | H21: 0 | I21: 0 | J21: А | K21: 0 | L21: 0 | M21: 0 | O21: =I21 -> 0 | P21: 9 | R21: - | U21: Неатест.
A22: 14 | B22: Рябинкин Дмитрий Олегович | C22: 7 | D22: 0 | E22: 11.666666666666668 | F22: 14 | G22: 0 | H22: 0 | I22: 25.666666666666668 | J22: А | K22: ??? | L22: 25.666666666666668 | M22: 0 | O22: =I22 -> 25.666666666666668 | Q22: - | R22: - | U22: Неатест.
A23: 15 | B23: Рязанцев Антон Юрьевич | C23: 5 | D23: 0 | E23: 8.3333333333333339 | F23: 20 | G23: 0 | H23: 0 | I23: 28.333333333333336 | J23: А | K23: 0 | L23: 28.333333333333336 | M23: 0 | O23: =I23 -> 28.333333333333336 | P23: 4 | R23: - | U23: Неатест.
A24: 16 | B24: Сонин Сергей Александрович | C24: 0 | D24: 0 | E24: 0 | F24: 0 | G24: 0 | H24: 0 | I24: 0 | J24: А | K24: 0 | L24: 0 | M24: 0 | O24: =I24 -> 0 | P24: 9 | R24: - | U24: Неатест.
A25: 17 | C25: 0 | D25: 0 | E25: 0 | F25: 0 | G25: 0 | H25: 0 | I25: 0 | J25: А | K25: 0 | L25: 0 | M25: 0 | O25: =I25 -> 0
A26: 18 | B26: Бородавин Юрий Викторович | C26: 6 | D26: 0 | E26: 10 | F26: 30 | G26: 0 | H26: 0 | I26: 40 | J26: А | K26: ??? | L26: 40 | M26: 0 | O26: =I26 -> 40 | Q26: - | R26: - | U26: Н/Д(конт)
A27: 19 | B27: Бородин Александр Валерьевич | C27: 6 | D27: 0 | E27: 10 | F27: 40 | G27: 0 | H27: 0 | I27: 50 | J27: А | K27: 15 | L27: 65 | M27: 0 | O27: =I27 -> 50 | Q27: - | R27: - | U27: Зачет
A28: 20 | B28: Воронцов Сергей Михайлович | C28: 6 | D28: 0 | E28: 10 | F28: 40 | G28: 0 | H28: 0 | I28: 50 | J28: А | K28: 15 | L28: 65 | M28: 0 | O28: =I28 -> 50 | Q28: - | R28: - | U28: Зачет
A29: 21 | B29: Дробилов Александр Валентинович | C29: 5 | D29: 0 | E29: 8.3333333333333339 | F29: 30 | G29: 0 | H29: 0 | I29: 38.333333333333336 | J29: А | K29: 0 | L29: 38.333333333333336 | M29: 0 | O29: =I29 -> 38.333333333333336 | P29: 4 | R29: - | U29: Неатест.
A30: 22 | B30: Егоров Денис Вадимович | C30: 5 | D30: 0 | E30: 8.3333333333333339 | F30: 14 | G30: 0 | H30: 0 | I30: 22.333333333333336 | J30: А | K30: 0 | L30: 22.333333333333336 | M30: 0 | O30: =I30 -> 22.333333333333336 | P30: 4 | R30: - | U30: Неатест.
A31: 23 | B31: Жуков Роман Евгеньевич | C31: 0 | D31: 0 | E31: 0 | F31: 0 | G31: 0 | H31: 0 | I31: 0 | J31: А | K31: 0 | L31: 0 | M31: 0 | O31: =I31 -> 0 | P31: 9 | R31: - | U31: Неатест.
A32: 24 | B32: Кибирев Александр Алексеевич | C32: 6 | D32: 0 | E32: 10 | F32: 40 | G32: 0 | H32: 0 | I32: 50 | J32: А | K32: 15 | L32: 65 | M32: 0 | O32: =I32 -> 50 | Q32: - | R32: - | U32: Зачет
A33: 25 | B33: Ковалев Олег Анатольевич | C33: 4 | D33: 0 | E33: 6.666666666666667 | F33: 14 | G33: 0 | H33: 0 | I33: 20.666666666666668 | J33: А | K33: 0 | L33: 20.666666666666668 | M33: 0 | O33: =I33 -> 20.666666666666668 | P33: 5 | R33: - | U33: Неатест.
A34: 26 | B34: Кожухов Евгений Андреевич | C34: 0 | D34: 0 | E34: 0 | F34: 0 | G34: 0 | H34: -5 | I34: -5 | J34: А | K34: 0 | L34: -5 | M34: 0 | O34: =I34 -> -5 | P34: 9 | R34: - | U34: Неатест.
A35: 27 | B35: Кочнев Владимир Николаевич | C35: 6 | D35: 0 | E35: 10 | F35: 40 | G35: 0 | H35: 2 | I35: 52 | J35: А | K35: 15 | L35: 67 | M35: 0 | O35: =I35 -> 52 | Q35: - | R35: - | U35: Зачет
A36: 28 | B36: Полушков Михаил Владимирович | C36: 6 | D36: 0 | E36: 10 | F36: 20 | G36: 0 | H36: 2 | I36: 32 | J36: А | K36: ??? | L36: 32 | M36: 0 | O36: =I36 -> 32 | Q36: - | R36: - | U36: Неатест.
A37: 29 | B37: Резухин Александр Игоревич | C37: 7 | D37: 0 | E37: 11.666666666666668 | F37: 14 | G37: 0 | H37: 0 | I37: 25.666666666666668 | J37: А | K37: ??? | L37: 25.666666666666668 | M37: 0 | O37: =I37 -> 25.666666666666668 | Q37: - | R37: - | U37: Неатест.
A38: 30 | B38: Телицын Евгений Владимирович | C38: 6 | D38: 0 | E38: 10 | F38: 20 | G38: 0 | H38: 0 | I38: 30 | J38: А | K38: ??? | L38: 30 | M38: 0 | O38: =I38 -> 30 | Q38: - | R38: - | U38: Неатест.
A39: 31 | B39: Шалин Алексей Геннадьевич | C39: 0 | D39: 0 | E39: 0 | F39: 0 | G39: 0 | H39: 0 | I39: 0 | J39: А | K39: 0 | L39: 0 | M39: 0 | O39: =I39 -> 0 | P39: 9 | R39: - | U39: Неатест.
A40: 32 | B40: Ямщиков Андрей Александрович | C40: 7 | D40: 0 | E40: 11.666666666666668 | F40: 20 | G40: 0 | H40: 0 | I40: 31.666666666666668 | J40: А | K40: ??? | L40: 31.666666666666668 | M40: 0 | O40: =I40 -> 31.666666666666668 | Q40: - | R40: - | U40: Неатест.
A41: 33 | C41: 0 | D41: 0 | E41: 0 | F41: 0 | G41: 0 | H41: 0 | I41: 0 | J41: А | K41: 0 | L41: 0 | M41: 0 | O41: =I41 -> 0
A42: 34 | B42: Лапшин Сергей М | C42: 0 | D42: 0 | E42: 0 | F42: 8 | G42: 0 | H42: 0 | I42: 8 | J42: А | K42: 0 | L42: 8 | M42: 0 | O42: =I42 -> 8 | P42: 9 | R42: - | U42: Неатест.