B1: Группа | C1: ЭМ-42 | I1: Дата последней коррекции: | P1: 40284
B2: Предмет | C2: ТАПЭС
B3: Вид отчетности | C3: Зачет | G3: Итоговый рейтинг
E6: 10 | F6: 40 | I6: max 60 | L6: max40 | O6: Зачет
C7: Текущий балл | J7: Автомат | P7: Вопросов | U7: Итоговая ОЦЕНКА
A8: № | B8: Ф.И.О. | C8: Лек. | D8: Курс. | E8: Блек | F8: Блаб | G8: Бкур | H8: Бдоп | I8: Бтек | J8: Авт | K8: Бавт | L8: ОБ(а) | M8: Оценка | O8: Бтек | P8: Доп | Q8: Отв | R8: Оценка | S8: Кол поп. | T8: ОБ
A9: 1 | B9: Бутылин Павел Николаевич | C9: 7 | D9: 0 | E9: 11.666666666666668 | F9: 20 | G9: 0 | H9: 0 | I9: 31.666666666666668 | J9: А | K9: ??? | L9: 31.666666666666668 | M9: Неатест. | O9: =I9 -> 31.666666666666668 | Q9: - | R9: - | U9: Неатест.
A10: 2 | B10: Варакин Денис Владимирович | C10: 8 | D10: 0 | E10: 13.333333333333334 | F10: 30 | G10: 0 | H10: 4 | I10: 47.333333333333336 | J10: А | K10: ??? | L10: 47.333333333333336 | M10: Н/Д(конт) | O10: =I10 -> 47.333333333333336 | Q10: - | R10: - | U10: Н/Д(конт)
A11: 3 | B11: Волостнов Иван Владимирович | C11: 6 | D11: 0 | E11: 10 | F11: 30 | G11: 0 | H11: 0 | I11: 40 | J11: А | K11: ??? | L11: 40 | M11: Н/Д(конт) | O11: =I11 -> 40 | Q11: - | R11: - | U11: Н/Д(конт)
A12: 4 | B12: Карюхин Алексей Юрьевич | C12: 7 | D12: 0 | E12: 11.666666666666668 | F12: 14 | G12: 0 | H12: 0 | I12: 25.666666666666668 | J12: А | K12: ??? | L12: 25.666666666666668 | M12: Неатест. | O12: =I12 -> 25.666666666666668 | Q12: - | R12: - | U12: Неатест.
A13: 5 | B13: Копейкин Дмитрий Иванович | C13: 5 | D13: 0 | E13: 8.3333333333333339 | F13: 30 | G13: 0 | H13: 0 | I13: 38.333333333333336 | J13: А | K13: 0 | L13: 38.333333333333336 | M13: Неатест. | O13: =I13 -> 38.333333333333336 | P13: 4 | R13: - | U13: Неатест.
A14: 6 | B14: Тарханов Сергей Евгеньевич | C14: 8 | D14: 0 | E14: 13.333333333333334 | F14: 20 | G14: 0 | H14: 0 | I14: 33.333333333333336 | J14: А | K14: ??? | L14: 33.333333333333336 | M14: Неатест. | O14: =I14 -> 33.333333333333336 | Q14: - | R14: - | U14: Неатест.
A15: 7 | B15: Трянин Денис Валерьевич | C15: 0 | D15: 0 | E15: 0 | F15: 0 | G15: 0 | H15: 0 | I15: 0 | J15: А | K15: 0 | L15: 0 | M15: Неатест. | O15: =I15 -> 0 | P15: 9 | R15: - | U15: Неатест.
A16: 8 | B16: Шепетов Николай Андреевич | C16: 3 | D16: 0 | E16: 5 | F16: 30 | G16: 0 | H16: 0 | I16: 35 | J16: А | K16: 0 | L16: 35 | M16: Неатест. | O16: =I16 -> 35 | P16: 6 | R16: - | U16: Неатест.
A17: 9 | C17: 0 | D17: 0 | E17: 0 | F17: 0 | G17: 0 | H17: 0 | I17: 0 | J17: А | K17: 0 | L17: 0 | M17: 0 | O17: =I17 -> 0
A18: 10 | B18: Залетнев Сергей Анатольевич | C18: 5 | D18: 0 | E18: 8.3333333333333339 | F18: 14 | G18: 0 | H18: 0 | I18: 22.333333333333336 | J18: А | K18: 0 | L18: 22.333333333333336 | M18: Неатест. | O18: =I18 -> 22.333333333333336 | P18: 4 | R18: - | U18: Неатест.
A19: 11 | B19: Казаков Денис Александрович | C19: 8 | D19: 0 | E19: 13.333333333333334 | F19: 20 | G19: 0 | H19: 0 | I19: 33.333333333333336 | J19: А | K19: ??? | L19: 33.333333333333336 | M19: Неатест. | O19: =I19 -> 33.333333333333336 | Q19: - | R19: - | U19: Неатест.
A20: 12 | B20: Комлев Иван Владимирович | C20: 5 | D20: 0 | E20: 8.3333333333333339 | F20: 14 | G20: 0 | H20: 0 | I20: 22.333333333333336 | J20: А | K20: 0 | L20: 22.333333333333336 | M20: Неатест. | O20: =I20 -> 22.333333333333336 | P20: 4 | R20: - | U20: Неатест.
A21: 13 | B21: Кузнецов Артем Александрович | C21: 0 | D21: 0 | E21: 0 | F21: 0 | G21: 0 | H21: -5 | I21: -5 | J21: А | K21: 0 | L21: -5 | M21: Неатест. | O21: =I21 -> -5 | P21: 9 | R21: - | U21: Неатест.
A22: 14 | B22: Мартынов Дмитрий Сергеевич | C22: 0 | D22: 0 | E22: 0 | F22: 0 | G22: 0 | H22: -5 | I22: -5 | J22: А | K22: 0 | L22: -5 | M22: Неатест. | O22: =I22 -> -5 | P22: 9 | R22: - | U22: Неатест.
A23: 15 | B23: Отекин Алексей Владимирович | C23: 5 | D23: 0 | E23: 8.3333333333333339 | F23: 14 | G23: 0 | H23: 0 | I23: 22.333333333333336 | J23: А | K23: 0 | L23: 22.333333333333336 | M23: Неатест. | O23: =I23 -> 22.333333333333336 | P23: 4 | R23: - | U23: Неатест.
A24: 16 | B24: Сазанов Роман Сергеевич | C24: 6 | D24: 0 | E24: 10 | F24: 14 | G24: 0 | H24: 0 | I24: 24 | J24: А | K24: ??? | L24: 24 | M24: Неатест. | O24: =I24 -> 24 | Q24: - | R24: - | U24: Неатест.
A25: 17 | B25: Соловьев Александр Геннадьевич | C25: 8 | D25: 0 | E25: 13.333333333333334 | F25: 14 | G25: 0 | H25: 0 | I25: 27.333333333333336 | J25: А | K25: ??? | L25: 27.333333333333336 | M25: Неатест. | O25: =I25 -> 27.333333333333336 | Q25: - | R25: - | U25: Неатест.
A26: 18 | B26: Стрельченко Алексей Юрьевич | C26: 8 | D26: 0 | E26: 13.333333333333334 | F26: 14 | G26: 0 | H26: 0 | I26: 27.333333333333336 | J26: А | K26: ??? | L26: 27.333333333333336 | M26: Неатест. | O26: =I26 -> 27.333333333333336 | Q26: - | R26: - | U26: Неатест.
A27: 19 | B27: Терехин Денис Владимирович | C27: 7 | D27: 0 | E27: 11.666666666666668 | F27: 20 | G27: 0 | H27: 0 | I27: 31.666666666666668 | J27: А | K27: ??? | L27: 31.666666666666668 | M27: Неатест. | O27: =I27 -> 31.666666666666668 | Q27: - | R27: - | U27: Неатест.