B1: Группа | C1: Р-41 | I1: Дата последней коррекции: | P1: 40283
B2: Предмет | C2: ИЭТРО
B3: Вид отчетности | C3: Зачет | G3: Итоговый рейтинг
E6: 10 | F6: 30 | I6: max 60 | L6: max40 | O6: Зачет
C7: Текущий балл | J7: Автомат | P7: Вопросов | U7: Итоговая ОЦЕНКА
A8: № | B8: Ф.И.О. | C8: Лек. | D8: Курс. | E8: Блек | F8: Блаб | G8: Бкур | H8: Бдоп | I8: Бтек | J8: Авт | K8: Бавт | L8: ОБ(а) | M8: Оценка | O8: Бтек | P8: Доп | Q8: Отв | R8: Оценка | S8: Кол поп. | T8: ОБ
A9: 1 | B9: Казаков Алексей Александрович | C9: 14 | D9: 0 | E9: 12.352941176470587 | F9: 35.8 | G9: 0 | H9: 0 | I9: 48.152941176470584 | J9: А | K9: 23.7 | L9: 71.85294117647058 | M9: Зачет | O9: =I9 -> 48.152941176470584 | Q9: - | R9: - | U9: Зачет
A10: 2 | B10: Казанцев Владимир Михайлович | C10: 1 | D10: 0 | E10: 0.88235294117647056 | F10: 9.1 | G10: 0 | H10: 0 | I10: 9.9823529411764707 | J10: А | K10: 10.2 | L10: 20.182352941176468 | M10: Неатест. | O10: =I10 -> 9.9823529411764707 | P10: 16 | R10: - | U10: Неатест.
A11: 3 | B11: Клюжев Максим Сергеевич | C11: 11 | D11: 0 | E11: 9.7058823529411757 | F11: 33.7 | G11: 0 | H11: 0 | I11: 43.405882352941177 | J11: А | K11: 21.7 | L11: 65.10588235294118 | M11: Н/Д (лек) | O11: =I11 -> 43.405882352941177 | P11: 6 | R11: - | U11: Н/Д (лек)
A12: 4 | B12: Коршунов Игорь Александрович | C12: 14 | D12: 0 | E12: 12.352941176470587 | F12: 32.8 | G12: 0 | H12: 0 | I12: 45.152941176470584 | J12: А | K12: 26.4 | L12: 71.552941176470583 | M12: Зачет | O12: =I12 -> 45.152941176470584 | Q12: - | R12: - | U12: Зачет
A13: 5 | B13: Кудряшов Сергей Петрович | C13: 3 | D13: 0 | E13: 2.6470588235294117 | F13: 9.1 | G13: 0 | H13: 0 | I13: 11.747058823529411 | J13: А | K13: 0 | L13: 11.747058823529411 | M13: Неатест. | O13: =I13 -> 11.747058823529411 | P13: 14 | R13: - | U13: Неатест.
A14: 6 | B14: Макарычев Максим Михайлович | C14: 13 | D14: 0 | E14: 11.470588235294118 | F14: 34.6 | G14: 0 | H14: 0 | I14: 46.070588235294117 | J14: А | K14: 25.2 | L14: 71.270588235294113 | M14: Зачет | O14: =I14 -> 46.070588235294117 | Q14: - | R14: - | U14: Зачет
A15: 7 | B15: Новичков Александр Сергеевич | C15: 13 | D15: 0 | E15: 11.470588235294118 | F15: 37 | G15: 0 | H15: 0 | I15: 48.470588235294116 | J15: А | K15: 21.9 | L15: 70.370588235294122 | M15: Зачет | O15: =I15 -> 48.470588235294116 | Q15: - | R15: - | U15: Зачет
A16: 8 | B16: Нозадзе Георгий Кахавич | C16: 11 | D16: 0 | E16: 9.7058823529411757 | F16: 32.8 | G16: 0 | H16: 0 | I16: 42.505882352941171 | J16: А | K16: 25.2 | L16: 67.705882352941174 | M16: Н/Д (лек) | O16: =I16 -> 42.505882352941171 | P16: 6 | R16: - | U16: Н/Д (лек)
A17: 9 | B17: Рябов Александр Александрович | C17: 11 | D17: 0 | E17: 9.7058823529411757 | F17: 31 | G17: 0 | H17: 0 | I17: 40.705882352941174 | J17: А | K17: 25.6 | L17: 66.305882352941182 | M17: Н/Д (лек) | O17: =I17 -> 40.705882352941174 | P17: 6 | R17: - | U17: Н/Д (лек)
A18: 10 | B18: Сидоров Алексей Сергеевич | C18: 13 | D18: 0 | E18: 11.470588235294118 | F18: 33.7 | G18: 0 | H18: 0 | I18: 45.170588235294119 | J18: А | K18: 24.9 | L18: 70.07058823529411 | M18: Зачет | O18: =I18 -> 45.170588235294119 | Q18: - | R18: - | U18: Зачет
A19: 11 | B19: Шибаев Антон Михайлович | C19: 8 | D19: 0 | E19: 7.0588235294117645 | F19: 35.8 | G19: 0 | H19: 0 | I19: 42.858823529411765 | J19: А | K19: 23.8 | L19: 66.658823529411762 | M19: Н/Д (лек) | O19: =I19 -> 42.858823529411765 | P19: 9 | R19: - | U19: Н/Д (лек)
A20: 12 | B20: Баринов Антон Евгеньевич | C20: 14 | D20: 0 | E20: 12.352941176470587 | F20: 37 | G20: 0 | H20: 0 | I20: 49.352941176470587 | J20: А | K20: 31 | L20: 80.35294117647058 | M20: Зачет | O20: =I20 -> 49.352941176470587 | Q20: - | R20: - | U20: Зачет
A21: 13 | B21: Березин Юрий Павлович | C21: 15 | D21: 0 | E21: 13.235294117647058 | F21: 35.8 | G21: 0 | H21: 0 | I21: 49.035294117647055 | J21: А | K21: 25.5 | L21: 74.535294117647055 | M21: Зачет | O21: =I21 -> 49.035294117647055 | Q21: - | R21: - | U21: Зачет
A22: 14 | B22: Бершов Алексей Олегович | C22: 13 | D22: 0 | E22: 11.470588235294118 | F22: 32.8 | G22: 0 | H22: 0 | I22: 44.270588235294113 | J22: А | K22: 23.8 | L22: 68.07058823529411 | M22: Незачет | O22: =I22 -> 44.270588235294113 | Q22: - | R22: - | U22: Незачет
A23: 15 | B23: Болдин Леонид Олегович | C23: 15 | D23: 0 | E23: 13.235294117647058 | F23: 32.8 | G23: 0 | H23: 0 | I23: 46.035294117647055 | J23: А | K23: 27 | L23: 73.035294117647055 | M23: Зачет | O23: =I23 -> 46.035294117647055 | Q23: - | R23: - | U23: Зачет
A24: 16 | B24: Заболотный Всеволод Владимирович | C24: 13 | D24: 0 | E24: 11.470588235294118 | F24: 37 | G24: 0 | H24: 0 | I24: 48.470588235294116 | J24: А | K24: 26.4 | L24: 74.870588235294122 | M24: Зачет | O24: =I24 -> 48.470588235294116 | Q24: - | R24: - | U24: Зачет
A25: 17 | B25: Зуев Артем Алексеевич | C25: 12 | D25: 0 | E25: 10.588235294117647 | F25: 34.9 | G25: 0 | H25: 0 | I25: 45.488235294117644 | J25: А | K25: 35.8 | L25: 81.288235294117641 | M25: Зачет | O25: =I25 -> 45.488235294117644 | Q25: - | R25: - | U25: Зачет
A26: 18 | B26: Кабанин Дмитрий Вячеславович | C26: 12 | D26: 0 | E26: 10.588235294117647 | F26: 35.5 | G26: 0 | H26: 0 | I26: 46.088235294117645 | J26: А | K26: 35.5 | L26: 81.588235294117652 | M26: Зачет | O26: =I26 -> 46.088235294117645 | Q26: - | R26: - | U26: Зачет
A27: 19 | B27: Кабанов Дмитрий Георгиевич | C27: 15 | D27: 0 | E27: 13.235294117647058 | F27: 34.9 | G27: 0 | H27: 0 | I27: 48.135294117647057 | J27: А | K27: 20.7 | L27: 68.835294117647052 | M27: Незачет | O27: =I27 -> 48.135294117647057 | Q27: - | R27: - | U27: Незачет
A28: 20 | B28: Кокурин Александр Николаевич | C28: 8 | D28: 0 | E28: 7.0588235294117645 | F28: 32.8 | G28: 0 | H28: 0 | I28: 39.858823529411765 | J28: А | K28: 10.5 | L28: 50.358823529411765 | M28: Неатест. | O28: =I28 -> 39.858823529411765 | P28: 9 | R28: - | U28: Неатест.
A29: 21 | B29: Колпаков Сергей Александрович | C29: 13 | D29: 0 | E29: 11.470588235294118 | F29: 37 | G29: 0 | H29: 0 | I29: 48.470588235294116 | J29: А | K29: 27 | L29: 75.470588235294116 | M29: Зачет | O29: =I29 -> 48.470588235294116 | Q29: - | R29: - | U29: Зачет
A30: 22 | B30: Макаров Алексей Юрьевич | C30: 12 | D30: 0 | E30: 10.588235294117647 | F30: 32.8 | G30: 0 | H30: 0 | I30: 43.388235294117642 | J30: А | K30: 24.9 | L30: 68.288235294117641 | M30: Незачет | O30: =I30 -> 43.388235294117642 | Q30: - | R30: - | U30: Незачет
A31: 23 | B31: Никулин Олег Юрьевич | C31: 14 | D31: 0 | E31: 12.352941176470587 | F31: 37.9 | G31: 0 | H31: 0 | I31: 50.252941176470586 | J31: А | K31: 27 | L31: 77.252941176470586 | M31: Зачет | O31: =I31 -> 50.252941176470586 | Q31: - | R31: - | U31: Зачет
A32: 24 | B32: Овчинников Олег Игоревич | C32: 12 | D32: 0 | E32: 10.588235294117647 | F32: 35.2 | G32: 0 | H32: 0 | I32: 45.788235294117648 | J32: А | K32: 12 | L32: 57.788235294117648 | M32: Незачет | O32: =I32 -> 45.788235294117648 | Q32: - | R32: - | U32: Незачет
A33: 25 | B33: Пушкарев Денис Владимирович | C33: 14 | D33: 0 | E33: 12.352941176470587 | F33: 34 | G33: 0 | H33: 0 | I33: 46.352941176470587 | J33: А | K33: 32.2 | L33: 78.552941176470597 | M33: Зачет | O33: =I33 -> 46.352941176470587 | Q33: - | R33: - | U33: Зачет
A34: 26 | B34: Шокин Дмитрий Алексеевич | C34: 14 | D34: 0 | E34: 12.352941176470587 | F34: 32.8 | G34: 0 | H34: 0 | I34: 45.152941176470584 | J34: А | K34: 27.1 | L34: 72.252941176470586 | M34: Зачет | O34: =I34 -> 45.152941176470584 | Q34: - | R34: - | U34: Зачет
A35: 27 | B35: Волков Антон Викторович | C35: 13 | D35: 0 | E35: 11.470588235294118 | F35: 35.8 | G35: 0 | H35: 0 | I35: 47.270588235294113 | J35: А | K35: 26.4 | L35: 73.670588235294105 | M35: Зачет | O35: =I35 -> 47.270588235294113 | Q35: - | R35: - | U35: Зачет
A36: 28 | B36: Гора Григорий Алексеевич | C36: 13 | D36: 0 | E36: 11.470588235294118 | F36: 34.9 | G36: 0 | H36: 0 | I36: 46.370588235294115 | J36: А | K36: 35.8 | L36: 82.170588235294105 | M36: Зачет | O36: =I36 -> 46.370588235294115 | Q36: - | R36: - | U36: Зачет
A37: 29 | B37: Груздев Сергей Михайлович | C37: 13 | D37: 0 | E37: 11.470588235294118 | F37: 38.8 | G37: 0 | H37: 10 | I37: 60 | J37: А | K37: 11.4 | L37: 71.4 | M37: Зачет | O37: =I37 -> 60 | Q37: - | R37: - | U37: Зачет
A38: 30 | B38: Дудин Василий Михайлович | C38: 14 | D38: 0 | E38: 12.352941176470587 | F38: 35.2 | G38: 0 | H38: 0 | I38: 47.55294117647059 | J38: А | K38: 20.7 | L38: 68.252941176470586 | M38: Незачет | O38: =I38 -> 47.55294117647059 | Q38: - | R38: - | U38: Незачет
A39: 31 | B39: Кузичкин Александр Владимирович | C39: 15 | D39: 0 | E39: 13.235294117647058 | F39: 32.8 | G39: 0 | H39: 0 | I39: 46.035294117647055 | J39: А | K39: 10.5 | L39: 56.535294117647055 | M39: Незачет | O39: =I39 -> 46.035294117647055 | Q39: - | R39: - | U39: Незачет
A40: 32 | B40: Отдельнов Артем Алексеевич | C40: 14 | D40: 0 | E40: 12.352941176470587 | F40: 37.6 | G40: 0 | H40: 0 | I40: 49.952941176470588 | J40: А | K40: 37.3 | L40: 87.252941176470586 | M40: Зачет | O40: =I40 -> 49.952941176470588 | Q40: - | R40: - | U40: Зачет
A41: 33 | B41: Рыбаков Олег Юрьевич | C41: 11 | D41: 0 | E41: 9.7058823529411757 | F41: 33.7 | G41: 0 | H41: 0 | I41: 43.405882352941177 | J41: А | K41: 35.2 | L41: 78.60588235294118 | M41: Н/Д (лек) | O41: =I41 -> 43.405882352941177 | P41: 6 | R41: - | U41: Н/Д (лек)
A42: 34 | B42: Шакиров Ильдар Алиевич | C42: 13 | D42: 0 | E42: 11.470588235294118 | F42: 17.3 | G42: 0 | H42: 0 | I42: 28.77058823529412 | J42: А | K42: 31 | L42: 59.77058823529412 | M42: Неатест. | O42: =I42 -> 28.77058823529412 | Q42: - | R42: - | U42: Неатест.
A43: 35 | B43: Шибаев Алексей Игоревич | C43: 15 | D43: 0 | E43: 13.235294117647058 | F43: 17.3 | G43: 0 | H43: 0 | I43: 30.535294117647059 | J43: А | K43: 20.7 | L43: 51.235294117647058 | M43: Неатест. | O43: =I43 -> 30.535294117647059 | Q43: - | R43: - | U43: Неатест.