B1: Группа | C1: ЭМ-51 | I1: Дата последней коррекции: | P1: 40283
B2: Предмет | C2: МТ в ССА
B3: Вид отчетности | C3: Зачет | G3: Итоговый рейтинг
E6: 7.5 | F6: 30 | I6: max 60 | L6: max40 | O6: Зачет
C7: Текущий балл | J7: Автомат | P7: Вопросов | U7: Итоговая ОЦЕНКА
A8: № | B8: Ф.И.О. | C8: Лек. | D8: Курс. | E8: Блек | F8: Блаб | G8: Бкур | H8: Бдоп | I8: Бтек | J8: Авт | K8: Бавт | L8: ОБ(а) | M8: Оценка | O8: Бтек | P8: Доп | Q8: Отв | R8: Оценка | S8: Кол поп. | T8: ОБ
A9: 1 | B9: Боржев Дмитрий Александрович | C9: 15 | D9: 0 | E9: 10.227272727272727 | F9: 63 | G9: 0 | H9: 0 | I9: 60 | J9: А | K9: 10.8 | L9: 70.8 | M9: Незачет | O9: =I9 -> 60 | Q9: - | R9: - | U9: Зачет
A10: 2 | B10: Вишняков Илья Николаевич | C10: 18 | D10: 0 | E10: 12.272727272727272 | F10: 63 | G10: 0 | H10: 0 | I10: 60 | J10: А | K10: 21.3 | L10: 81.3 | M10: Зачет | O10: =I10 -> 60 | Q10: - | R10: - | U10: Зачет
A11: 3 | B11: Калинин Вячеслав Николаевич | C11: 16 | D11: 0 | E11: 10.909090909090908 | F11: 78 | G11: 0 | H11: 0 | I11: 60 | J11: А | K11: 21.3 | L11: 81.3 | M11: Зачет | O11: =I11 -> 60 | Q11: - | R11: - | U11: Зачет
A12: 4 | B12: Калинин Евгений Николаевич | C12: 16 | D12: 0 | E12: 10.909090909090908 | F12: 63 | G12: 0 | H12: 0 | I12: 60 | J12: А | K12: 10.8 | L12: 70.8 | M12: Незачет | O12: =I12 -> 60 | Q12: - | R12: - | U12: Н/Д(конт)
A13: 5 | B13: Кокин Сергей Александрович | C13: 16 | D13: 0 | E13: 10.909090909090908 | F13: 63 | G13: 0 | H13: 0 | I13: 60 | J13: А | K13: 21.3 | L13: 81.3 | M13: Зачет | O13: =I13 -> 60 | Q13: - | R13: - | U13: Незачет
A14: 6 | B14: Кучаев Максим Анатольевич | C14: 18 | D14: 0 | E14: 12.272727272727272 | F14: 63 | G14: 0 | H14: 0 | I14: 60 | J14: А | K14: 21.3 | L14: 81.3 | M14: Зачет | O14: =I14 -> 60 | Q14: - | R14: - | U14: Незачет
A15: 7 | B15: Майоров Роман Владимирович | C15: 18 | D15: 0 | E15: 12.272727272727272 | F15: 63 | G15: 0 | H15: 0 | I15: 60 | J15: А | K15: 21.3 | L15: 81.3 | M15: Зачет | O15: =I15 -> 60 | Q15: - | R15: - | U15: Незачет
A16: 8 | B16: Мочалов Николай Александрович | C16: 8 | D16: 0 | E16: 5.4545454545454541 | F16: 0 | G16: 0 | H16: 0 | I16: 5.4545454545454541 | J16: А | K16: 13.5 | L16: 18.954545454545453 | M16: Неатест. | O16: =I16 -> 5.4545454545454541 | P16: 14 | R16: - | U16: Неатест.
A17: 9 | B17: Мыльников Сергей Валерьевич | C17: 17 | D17: 0 | E17: 11.59090909090909 | F17: 78 | G17: 0 | H17: 0 | I17: 60 | J17: А | K17: 21.3 | L17: 81.3 | M17: Зачет | O17: =I17 -> 60 | Q17: - | R17: - | U17: Зачет
A18: 10 | B18: Нуждин Сергей Викторович | C18: 17 | D18: 0 | E18: 11.59090909090909 | F18: 63 | G18: 0 | H18: 0 | I18: 60 | J18: А | K18: 21.3 | L18: 81.3 | M18: Зачет | O18: =I18 -> 60 | Q18: - | R18: - | U18: Зачет
A19: 11 | B19: Окунев Максим Николаевич | C19: 13 | D19: 0 | E19: 8.8636363636363633 | F19: 63 | G19: 0 | H19: 0 | I19: 60 | J19: А | K19: 24.3 | L19: 84.3 | M19: Зачет | O19: =I19 -> 60 | Q19: - | R19: - | U19: Незачет
A20: 12 | B20: Плахин Владимир Николаевич | C20: 17 | D20: 0 | E20: 11.59090909090909 | F20: 78 | G20: 0 | H20: 0 | I20: 60 | J20: А | K20: 21.3 | L20: 81.3 | M20: Зачет | O20: =I20 -> 60 | Q20: - | R20: - | U20: Зачет
A21: 13 | B21: Терелецкий Максим Александрович | C21: 12 | D21: 0 | E21: 8.1818181818181817 | F21: 0 | G21: 0 | H21: 0 | I21: 8.1818181818181817 | J21: А | K21: ??? | L21: 8.1818181818181817 | M21: Неатест. | O21: =I21 -> 8.1818181818181817 | Q21: - | R21: - | U21: Неатест.
A22: 14 | B22: Фролов Дмитрий Владимирович | C22: 16 | D22: 0 | E22: 10.909090909090908 | F22: 63 | G22: 0 | H22: 0 | I22: 60 | J22: А | K22: 24.3 | L22: 84.3 | M22: Зачет | O22: =I22 -> 60 | Q22: - | R22: - | U22: Незачет
A23: 15 | C23: 0 | D23: 0 | E23: 0 | F23: 0 | G23: 0 | H23: 0 | I23: 0 | J23: А | K23: 0 | L23: 0 | M23: 0 | O23: =I23 -> 0
A24: 16 | B24: Булычев Алексей Вадимович | C24: 15 | D24: 0 | E24: 10.227272727272727 | F24: 48 | G24: 0 | H24: 0 | I24: 58.227272727272727 | J24: А | K24: 21.3 | L24: 79.527272727272731 | M24: Зачет | O24: =I24 -> 58.227272727272727 | Q24: - | R24: - | U24: Зачет
A25: 17 | B25: Ермаков Иван Сергеевич | C25: 15 | D25: 0 | E25: 10.227272727272727 | F25: 48 | G25: 0 | H25: 0 | I25: 58.227272727272727 | J25: А | K25: ??? | L25: 58.227272727272727 | M25: Н/Д(конт) | O25: =I25 -> 58.227272727272727 | Q25: - | R25: - | U25: Н/Д(конт)
A26: 18 | B26: Захаров Сергей Сергеевич | C26: 13 | D26: 0 | E26: 8.8636363636363633 | F26: 25 | G26: 0 | H26: 0 | I26: 33.86363636363636 | J26: А | K26: ??? | L26: 33.86363636363636 | M26: Неатест. | O26: =I26 -> 33.86363636363636 | Q26: - | R26: - | U26: Неатест.
A27: 19 | B27: Лебедев Василий Владимирович | C27: 11 | D27: 0 | E27: 7.5 | F27: 78 | G27: 0 | H27: 0 | I27: 60 | J27: А | K27: 18 | L27: 78 | M27: Зачет | O27: =I27 -> 60 | Q27: - | R27: - | U27: Зачет
A28: 20 | B28: Масленников Александр Васильевич | C28: 14 | D28: 0 | E28: 9.545454545454545 | F28: 25 | G28: 0 | H28: 0 | I28: 34.545454545454547 | J28: А | K28: 10.8 | L28: 45.345454545454544 | M28: Неатест. | O28: =I28 -> 34.545454545454547 | Q28: - | R28: - | U28: Неатест.
A29: 21 | B29: Поляшев Алексей Николаевич | C29: 15 | D29: 0 | E29: 10.227272727272727 | F29: 48 | G29: 0 | H29: 0 | I29: 58.227272727272727 | J29: А | K29: ??? | L29: 58.227272727272727 | M29: Н/Д(конт) | O29: =I29 -> 58.227272727272727 | Q29: - | R29: - | U29: Н/Д(конт)
A30: 22 | B30: Салтыков Алексей Валерьевич | C30: 12 | D30: 0 | E30: 8.1818181818181817 | F30: 48 | G30: 0 | H30: 0 | I30: 56.18181818181818 | J30: А | K30: 10.5 | L30: 66.681818181818187 | M30: Незачет | O30: =I30 -> 56.18181818181818 | Q30: - | R30: - | U30: Незачет
A31: 23 | B31: Смолин Николай Геннадьевич | C31: 8 | D31: 0 | E31: 5.4545454545454541 | F31: 25 | G31: 0 | H31: 0 | I31: 30.454545454545453 | J31: А | K31: 13.5 | L31: 43.954545454545453 | M31: Неатест. | O31: =I31 -> 30.454545454545453 | P31: 14 | R31: - | U31: Неатест.
A32: 24 | B32: Чистяков Никита Александрович | C32: 16 | D32: 0 | E32: 10.909090909090908 | F32: 48 | G32: 0 | H32: 0 | I32: 58.909090909090907 | J32: А | K32: ??? | L32: 58.909090909090907 | M32: Н/Д(конт) | O32: =I32 -> 58.909090909090907 | Q32: - | R32: - | U32: Н/Д(конт)
A33: 25 | B33: Ярыгин Дмитрий Владимирович | C33: 15 | D33: 0 | E33: 10.227272727272727 | F33: 25 | G33: 0 | H33: 0 | I33: 35.227272727272727 | J33: А | K33: 10.8 | L33: 46.027272727272731 | M33: Неатест. | O33: =I33 -> 35.227272727272727 | Q33: - | R33: - | U33: Неатест.