B1: Группа | C1: ЭМ-53 | I1: Дата последней коррекции: | P1: 40283
B2: Предмет | C2: МТ в ССА
B3: Вид отчетности | C3: Зачет | G3: Итоговый рейтинг
E6: 7.5 | F6: 30 | I6: max 60 | L6: max40 | O6: Зачет
C7: Текущий балл | J7: Автомат | P7: Вопросов | U7: Итоговая ОЦЕНКА
A8: № | B8: Ф.И.О. | C8: Лек. | D8: Курс. | E8: Блек | F8: Блаб | G8: Бкур | H8: Бдоп | I8: Бтек | J8: Авт | K8: Бавт | L8: ОБ(а) | M8: Оценка | O8: Бтек | P8: Доп | Q8: Отв | R8: Оценка | S8: Кол поп. | T8: ОБ
A9: 1 | B9: Антонычев Дмитрий Борисович | C9: 10 | D9: 0 | E9: 8.3333333333333339 | F9: 0 | G9: 0 | H9: 0 | I9: 8.3333333333333339 | J9: А | K9: 13.2 | L9: 21.533333333333331 | M9: Неатест. | O9: =I9 -> 8.3333333333333339 | Q9: - | R9: - | U9: Неатест.
A10: 2 | B10: Веснин Алексей Владимирович | C10: 10 | D10: 0 | E10: 8.3333333333333339 | F10: 0 | G10: 0 | H10: 0 | I10: 8.3333333333333339 | J10: А | K10: 15.3 | L10: 23.633333333333333 | M10: Неатест. | O10: =I10 -> 8.3333333333333339 | Q10: - | R10: - | U10: Неатест.
A11: 3 | B11: Кашин Александр Сергеевич | C11: 7 | D11: 0 | E11: 5.8333333333333339 | F11: 0 | G11: 0 | H11: 0 | I11: 5.8333333333333339 | J11: А | K11: 0 | L11: 5.8333333333333339 | M11: Неатест. | O11: =I11 -> 5.8333333333333339 | P11: 11 | R11: - | U11: Неатест.
A12: 4 | B12: Киян Артем Олегович | C12: 10 | D12: 0 | E12: 8.3333333333333339 | F12: 42.6 | G12: 0 | H12: 0 | I12: 50.933333333333337 | J12: А | K12: ??? | L12: 50.933333333333337 | M12: Н/Д(конт) | O12: =I12 -> 50.933333333333337 | Q12: - | R12: - | U12: Н/Д(конт)
A13: 5 | B13: Кудзиев Павел Игоревич | C13: 8 | D13: 0 | E13: 6.666666666666667 | F13: 31.8 | G13: 0 | H13: 7 | I13: 45.466666666666669 | K13: 0 | L13: 45.466666666666669 | M13: Н/Д (лек) | O13: =I13 -> 45.466666666666669 | P13: 10 | Q13: 10 | R13: 3 | T13: 75.466666666666669 | U13: Зачет
A14: 6 | B14: Медведчиков Александр Сергеевич | C14: 16 | D14: 0 | E14: 13.333333333333334 | F14: 58.5 | G14: 0 | H14: 0 | I14: 60 | J14: А | K14: 19.5 | L14: 79.5 | M14: Зачет | O14: =I14 -> 60 | Q14: - | R14: - | U14: Зачет
A15: 7 | B15: Михайлов Евгений Александрович | C15: 17 | D15: 0 | E15: 14.166666666666668 | F15: 63 | G15: 0 | H15: 0 | I15: 60 | J15: А | K15: 23.1 | L15: 83.1 | M15: Зачет | O15: =I15 -> 60 | Q15: - | R15: - | U15: Зачет
A16: 8 | B16: Мурашев Андрей Олегович | C16: 13 | D16: 0 | E16: 10.833333333333334 | F16: 63 | G16: 0 | H16: 0 | I16: 60 | J16: А | K16: 15.3 | L16: 75.3 | M16: Зачет | O16: =I16 -> 60 | Q16: - | R16: - | U16: Незачет
A17: 9 | B17: Овсянников Евгений Сергеевич | C17: 10 | D17: 0 | E17: 8.3333333333333339 | F17: 0 | G17: 0 | H17: 0 | I17: 8.3333333333333339 | J17: А | K17: ??? | L17: 8.3333333333333339 | M17: Неатест. | O17: =I17 -> 8.3333333333333339 | Q17: - | R17: - | U17: Неатест.
A18: 10 | B18: Прибыткин Денис Александрович | C18: 15 | D18: 0 | E18: 12.5 | F18: 48 | G18: 0 | H18: 5 | I18: 60 | J18: А | K18: 15 | L18: 75 | M18: Зачет | O18: =I18 -> 60 | Q18: - | R18: - | U18: Зачет
A19: 11 | B19: Прончатов Сергей Владимирович | C19: 12 | D19: 0 | E19: 10 | F19: 45 | G19: 0 | H19: 0 | I19: 55 | J19: А | K19: 9.6 | L19: 64.6 | M19: Незачет | O19: =I19 -> 55 | Q19: - | R19: - | U19: Незачет
A20: 12 | B20: Рудаков Виталий Александрович | C20: 0 | D20: 0 | E20: 0 | F20: 0 | G20: 0 | H20: 0 | I20: 0 | J20: А | K20: 0 | L20: 0 | M20: Неатест. | O20: =I20 -> 0 | P20: 18 | R20: - | U20: Неатест.
A21: 13 | B21: Сизов Александр Михайлович | C21: 13 | D21: 0 | E21: 10.833333333333334 | F21: 37.8 | G21: 0 | H21: 0 | I21: 48.633333333333333 | J21: А | K21: ??? | L21: 48.633333333333333 | M21: Н/Д(конт) | O21: =I21 -> 48.633333333333333 | Q21: - | R21: - | U21: Н/Д(конт)
A22: 14 | B22: Умнов Сергей Николаевич | C22: 12 | D22: 0 | E22: 10 | F22: 22 | G22: 0 | H22: 0 | I22: 32 | J22: А | K22: 23.1 | L22: 55.1 | M22: Неатест. | O22: =I22 -> 32 | Q22: - | R22: - | U22: Неатест.
A23: 15 | B23: Хренов Александр Сергеевич | C23: 12 | D23: 0 | E23: 10 | F23: 45 | G23: 0 | H23: 0 | I23: 55 | J23: А | K23: 15 | L23: 70 | M23: Незачет | O23: =I23 -> 55 | Q23: - | R23: - | U23: Незачет
A24: 16 | C24: 0 | D24: 0 | E24: 0 | F24: 0 | G24: 0 | H24: 0 | I24: 0 | J24: А | K24: 0 | L24: 0 | M24: 0 | O24: =I24 -> 0
A25: 17 | B25: Батраков Андрей Валерьевич | C25: 15 | D25: 0 | E25: 12.5 | F25: 63 | G25: 0 | H25: 0 | I25: 60 | J25: А | K25: 23.1 | L25: 83.1 | M25: Зачет | O25: =I25 -> 60 | Q25: - | R25: - | U25: Зачет
A26: 18 | B26: Бурцев Илья Александрович | C26: 0 | D26: 0 | E26: 0 | F26: 0 | G26: 0 | H26: 0 | I26: 0 | J26: А | K26: 0 | L26: 0 | M26: Неатест. | O26: =I26 -> 0 | P26: 18 | R26: - | U26: Неатест.
A27: 19 | B27: Гришин Дмитрий Сергеевич | C27: 0 | D27: 0 | E27: 0 | F27: 0 | G27: 0 | H27: 0 | I27: 0 | J27: А | K27: 0 | L27: 0 | M27: Неатест. | O27: =I27 -> 0 | P27: 18 | R27: - | U27: Неатест.
A28: 20 | B28: Иванов Михаил Михайлович | C28: 7 | D28: 0 | E28: 5.8333333333333339 | F28: 25 | G28: 0 | H28: 0 | I28: 30.833333333333336 | J28: А | K28: 28.5 | L28: 59.333333333333336 | M28: Неатест. | O28: =I28 -> 30.833333333333336 | P28: 11 | R28: - | U28: Неатест.
A29: 21 | B29: Карпов Андрей Николаевич | C29: 15 | D29: 0 | E29: 12.5 | F29: 48 | G29: 0 | H29: 0 | I29: 60 | J29: А | K29: 23.1 | L29: 83.1 | M29: Зачет | O29: =I29 -> 60 | Q29: - | R29: - | U29: Незачет
A30: 22 | B30: Корягин Сергей Викторович | C30: 15 | D30: 0 | E30: 12.5 | F30: 63 | G30: 0 | H30: 0 | I30: 60 | J30: А | K30: 19.5 | L30: 79.5 | M30: Зачет | O30: =I30 -> 60 | Q30: - | R30: - | U30: Зачет
A31: 23 | B31: Лихачев Максим Олегович | C31: 4 | D31: 0 | E31: 3.3333333333333335 | F31: 22 | G31: 0 | H31: 0 | I31: 25.333333333333332 | J31: А | K31: 0 | L31: 25.333333333333332 | M31: Неатест. | O31: =I31 -> 25.333333333333332 | P31: 14 | R31: - | U31: Неатест.
A32: 24 | B32: Лопатин Игорь Павлович | C32: 15 | D32: 0 | E32: 12.5 | F32: 63 | G32: 0 | H32: 5 | I32: 60 | J32: А | K32: 23.1 | L32: 83.1 | M32: Зачет | O32: =I32 -> 60 | Q32: - | R32: - | U32: Зачет
A33: 25 | B33: Мох Сергей Валерьевич | C33: 11 | D33: 0 | E33: 9.1666666666666679 | F33: 56.7 | G33: 0 | H33: 0 | I33: 60 | J33: А | K33: 19.5 | L33: 79.5 | M33: Зачет | O33: =I33 -> 60 | Q33: - | R33: - | U33: Зачет
A34: 26 | B34: Прончатов Александр Владимирович | C34: 13 | D34: 0 | E34: 10.833333333333334 | F34: 48 | G34: 0 | H34: 0 | I34: 58.833333333333336 | J34: А | K34: 19.5 | L34: 78.333333333333343 | M34: Зачет | O34: =I34 -> 58.833333333333336 | Q34: - | R34: - | U34: Незачет
A35: 27 | B35: Смирин Алексей Анатольевич | C35: 17 | D35: 0 | E35: 14.166666666666668 | F35: 63 | G35: 0 | H35: 0 | I35: 60 | J35: А | K35: 24.9 | L35: 84.9 | M35: Зачет | O35: =I35 -> 60 | Q35: - | R35: - | U35: Зачет
A36: 28 | B36: Смирнов Вадим Владимирович | C36: 16 | D36: 0 | E36: 13.333333333333334 | F36: 63 | G36: 0 | H36: 0 | I36: 60 | J36: А | K36: 23.1 | L36: 83.1 | M36: Зачет | O36: =I36 -> 60 | Q36: - | R36: - | U36: Зачет
A37: 29 | B37: Соколовский Михаил Сергеевич | C37: 0 | D37: 0 | E37: 0 | F37: 0 | G37: 0 | H37: 0 | I37: 0 | J37: А | K37: 0 | L37: 0 | M37: Неатест. | O37: =I37 -> 0 | P37: 18 | R37: - | U37: Неатест.
A38: 30 | B38: Сорокин Евгений Вячеславович | C38: 12 | D38: 0 | E38: 10 | F38: 48 | G38: 0 | H38: 0 | I38: 58 | J38: А | K38: ??? | L38: 58 | M38: Н/Д(конт) | O38: =I38 -> 58 | Q38: - | R38: - | U38: Н/Д(конт)
A39: 31 | B39: Филиппов Андрей Алексеевич | C39: 6 | D39: 0 | E39: 5 | F39: 22 | G39: 0 | H39: 0 | I39: 27 | J39: А | K39: 0 | L39: 27 | M39: Неатест. | O39: =I39 -> 27 | P39: 12 | R39: - | U39: Неатест.
A40: 32 | B40: Филонов Антон Александрович | C40: 12 | D40: 0 | E40: 10 | F40: 63 | G40: 0 | H40: 0 | I40: 60 | J40: А | K40: 19.5 | L40: 79.5 | M40: Зачет | O40: =I40 -> 60 | Q40: - | R40: - | U40: Зачет
A41: 33 | B41: Шошин Евгений Вячеславович | C41: 15 | D41: 0 | E41: 12.5 | F41: 63 | G41: 0 | H41: 0 | I41: 60 | J41: А | K41: 24.9 | L41: 84.9 | M41: Зачет | O41: =I41 -> 60 | Q41: - | R41: - | U41: Зачет
A42: 34 | C42: 0 | D42: 0 | E42: 0 | F42: 0 | G42: 0 | H42: 0 | I42: 0 | J42: А | K42: 0 | L42: 0 | M42: 0 | O42: =I42 -> 0