B1: Группа | C1: ЭМ-52 | I1: Дата последней коррекции: | P1: 40283
B2: Предмет | C2: МТ в ССА
B3: Вид отчетности | C3: Зачет | G3: Итоговый рейтинг
E6: 7.5 | F6: 30 | I6: max 60 | L6: max40 | O6: Зачет
C7: Текущий балл | J7: Автомат | P7: Вопросов | U7: Итоговая ОЦЕНКА
A8: № | B8: Ф.И.О. | C8: Лек. | D8: Курс. | E8: Блек | F8: Блаб | G8: Бкур | H8: Бдоп | I8: Бтек | J8: Авт | K8: Бавт | L8: ОБ(а) | M8: Оценка | O8: Бтек | P8: Доп | Q8: Отв | R8: Оценка | S8: Кол поп. | T8: ОБ
A9: 1 | B9: Базанов Антон Николаевич | C9: 2 | D9: 0 | E9: 1.3636363636363635 | F9: 0 | G9: 0 | H9: 0 | I9: 1.3636363636363635 | J9: А | K9: 0 | L9: 1.3636363636363635 | M9: Неатест. | O9: =I9 -> 1.3636363636363635 | P9: 20 | R9: - | U9: Неатест.
A10: 2 | B10: Баляев Евгений Андреевич | C10: 5 | D10: 0 | E10: 3.4090909090909087 | F10: 45.6 | G10: 0 | H10: 5 | I10: 54.009090909090908 | J10: А | K10: 19.5 | L10: 73.509090909090901 | M10: Н/Д (лек) | O10: =I10 -> 54.009090909090908 | P10: 17 | R10: - | U10: Н/Д (лек)
A11: 3 | B11: Богданов Александр Сергеевич | C11: 15 | D11: 0 | E11: 10.227272727272727 | F11: 16 | G11: 0 | H11: 6 | I11: 32.227272727272727 | J11: А | K11: ??? | L11: 32.227272727272727 | M11: Неатест. | O11: =I11 -> 32.227272727272727 | Q11: - | R11: - | U11: Неатест.
A12: 4 | B12: Буйнов Артем Владимирович | C12: 13 | D12: 0 | E12: 8.8636363636363633 | F12: 22 | G12: 0 | H12: 0 | I12: 30.863636363636363 | J12: А | K12: 9.9 | L12: 40.763636363636365 | M12: Неатест. | O12: =I12 -> 30.863636363636363 | Q12: - | R12: - | U12: Неатест.
A13: 5 | B13: Василькевич Константин Александрович | C13: 0 | D13: 0 | E13: 0 | F13: 0 | G13: 0 | H13: 0 | I13: 0 | J13: А | K13: 0 | L13: 0 | M13: Неатест. | O13: =I13 -> 0 | P13: 22 | R13: - | U13: Неатест.
A14: 6 | B14: Воробьев Артем Владимирович | C14: 2 | D14: 0 | E14: 1.3636363636363635 | F14: 0 | G14: 0 | H14: 0 | I14: 1.3636363636363635 | J14: А | K14: 0 | L14: 1.3636363636363635 | M14: Неатест. | O14: =I14 -> 1.3636363636363635 | P14: 20 | R14: - | U14: Неатест.
A15: 7 | B15: Гришин Валерий Алексеевич | C15: 10 | D15: 0 | E15: 6.8181818181818175 | F15: 25 | G15: 0 | H15: 2 | I15: 33.818181818181813 | J15: А | K15: 9.9 | L15: 43.718181818181812 | M15: Неатест. | O15: =I15 -> 33.818181818181813 | P15: 12 | R15: - | U15: Неатест.
A16: 8 | B16: Зотов Александр Игоревич | C16: 15 | D16: 0 | E16: 10.227272727272727 | F16: 45.6 | G16: 0 | H16: 5 | I16: 60 | J16: А | K16: 9.6 | L16: 69.6 | M16: Незачет | O16: =I16 -> 60 | Q16: - | R16: - | U16: Незачет
A17: 9 | B17: Каниськин Николай Сергеевич | C17: 0 | D17: 0 | E17: 0 | F17: 0 | G17: 0 | H17: 0 | I17: 0 | J17: А | K17: 0 | L17: 0 | M17: Неатест. | O17: =I17 -> 0 | P17: 22 | R17: - | U17: Неатест.
A18: 10 | B18: Кузьмин Роман Игоревич | C18: 16 | D18: 0 | E18: 10.909090909090908 | F18: 25 | G18: 0 | H18: 4 | I18: 39.909090909090907 | J18: А | K18: 19.5 | L18: 59.409090909090907 | M18: Неатест. | O18: =I18 -> 39.909090909090907 | Q18: - | R18: - | U18: Неатест.
A19: 11 | B19: Люндин Вадим Евгеньевич | C19: 15 | D19: 0 | E19: 10.227272727272727 | F19: 25 | G19: 0 | H19: 16 | I19: 51.227272727272727 | J19: А | K19: 9.6 | L19: 60.827272727272728 | M19: Незачет | O19: =I19 -> 51.227272727272727 | Q19: - | R19: - | U19: Незачет
A20: 12 | B20: Малышев Алексей Алексеевич | C20: 14 | D20: 0 | E20: 9.545454545454545 | F20: 16 | G20: 0 | H20: 4 | I20: 29.545454545454547 | J20: А | K20: 23.1 | L20: 52.645454545454548 | M20: Неатест. | O20: =I20 -> 29.545454545454547 | Q20: - | R20: - | U20: Неатест.
A21: 13 | B21: Попов Сергей Николаевич | C21: 4 | D21: 0 | E21: 2.7272727272727271 | F21: 0 | G21: 0 | H21: 3 | I21: 5.7272727272727266 | J21: А | K21: 0 | L21: 5.7272727272727266 | M21: Неатест. | O21: =I21 -> 5.7272727272727266 | P21: 18 | R21: - | U21: Неатест.
A22: 14 | B22: Самарин Борис Дмитриевич | C22: 0 | D22: 0 | E22: 0 | F22: 25 | G22: 0 | H22: 0 | I22: 25 | J22: А | K22: 0 | L22: 25 | M22: Неатест. | O22: =I22 -> 25 | P22: 22 | R22: - | U22: Неатест.
A23: 15 | B23: Ульянов Юрий Владимирович | C23: 1 | D23: 0 | E23: 0.68181818181818177 | F23: 0 | G23: 0 | H23: 0 | I23: 0.68181818181818177 | J23: А | K23: 0 | L23: 0.68181818181818177 | M23: Неатест. | O23: =I23 -> 0.68181818181818177 | P23: 21 | R23: - | U23: Неатест.
A24: 16 | B24: Хакимов Вадим Ильдарович | C24: 1 | D24: 0 | E24: 0.68181818181818177 | F24: 0 | G24: 0 | H24: 0 | I24: 0.68181818181818177 | J24: А | K24: 0 | L24: 0.68181818181818177 | M24: Неатест. | O24: =I24 -> 0.68181818181818177 | P24: 21 | R24: - | U24: Неатест.
A25: 17 | B25: Чернышов Сергей Александрович | C25: 7 | D25: 0 | E25: 4.7727272727272725 | F25: 0 | G25: 0 | H25: 2 | I25: 6.7727272727272725 | J25: А | K25: 0 | L25: 6.7727272727272725 | M25: Неатест. | O25: =I25 -> 6.7727272727272725 | P25: 15 | R25: - | U25: Неатест.
A26: 18 | B26: Юзиков Артем Иванович | C26: 7 | D26: 0 | E26: 4.7727272727272725 | F26: 0 | G26: 0 | H26: 0 | I26: 4.7727272727272725 | J26: А | K26: 19.5 | L26: 24.272727272727273 | M26: Неатест. | O26: =I26 -> 4.7727272727272725 | P26: 15 | R26: - | U26: Неатест.
A27: 19 | C27: 0 | D27: 0 | E27: 0 | F27: 0 | G27: 0 | H27: 0 | I27: 0 | J27: А | K27: 0 | L27: 0 | M27: 0 | O27: =I27 -> 0
A28: 20 | B28: Алексеев Илья Алексеевич | C28: 13 | D28: 0 | E28: 8.8636363636363633 | F28: 0 | G28: 0 | H28: 2 | I28: 10.863636363636363 | J28: А | K28: 28.5 | L28: 39.36363636363636 | M28: Неатест. | O28: =I28 -> 10.863636363636363 | Q28: - | R28: - | U28: Неатест.
A29: 21 | B29: Веселов Денис Васильевич | C29: 14 | D29: 0 | E29: 9.545454545454545 | F29: 0 | G29: 0 | H29: 2 | I29: 11.545454545454545 | J29: А | K29: 28.5 | L29: 40.045454545454547 | M29: Неатест. | O29: =I29 -> 11.545454545454545 | Q29: - | R29: - | U29: Неатест.
A30: 22 | B30: Земцов Артем Владимирович | C30: 12 | D30: 0 | E30: 8.1818181818181817 | F30: 48 | G30: 0 | H30: 0 | I30: 56.18181818181818 | J30: А | K30: 24.9 | L30: 81.081818181818178 | M30: Зачет | O30: =I30 -> 56.18181818181818 | Q30: - | R30: - | U30: Зачет
A31: 23 | B31: Малоземов Михаил Александрович | C31: 17 | D31: 0 | E31: 11.59090909090909 | F31: 48 | G31: 0 | H31: 5 | I31: 60 | J31: А | K31: 30.3 | L31: 90.3 | M31: Зачет | O31: =I31 -> 60 | Q31: - | R31: - | U31: Зачет
A32: 24 | B32: Махалов Михаил Александрович | C32: 12 | D32: 0 | E32: 8.1818181818181817 | F32: 0 | G32: 0 | H32: 0 | I32: 8.1818181818181817 | J32: А | K32: 9.6 | L32: 17.781818181818181 | M32: Неатест. | O32: =I32 -> 8.1818181818181817 | Q32: - | R32: - | U32: Неатест.
A33: 25 | B33: Мышкин Алексей Евгеньевич | C33: 13 | D33: 0 | E33: 8.8636363636363633 | F33: 0 | G33: 0 | H33: 0 | I33: 8.8636363636363633 | J33: А | K33: 24.9 | L33: 33.763636363636365 | M33: Неатест. | O33: =I33 -> 8.8636363636363633 | Q33: - | R33: - | U33: Неатест.
A34: 26 | B34: Пашин Николай Алексеевич | C34: 16 | D34: 0 | E34: 10.909090909090908 | F34: 48 | G34: 0 | H34: 5 | I34: 60 | J34: А | K34: 24.9 | L34: 84.9 | M34: Зачет | O34: =I34 -> 60 | Q34: - | R34: - | U34: Зачет
A35: 27 | B35: Пилипенков Михаил Владимирович | C35: 15 | D35: 0 | E35: 10.227272727272727 | F35: 40.8 | G35: 0 | H35: 2 | I35: 53.027272727272724 | J35: А | K35: 23.1 | L35: 76.127272727272725 | M35: Зачет | O35: =I35 -> 53.027272727272724 | Q35: - | R35: - | U35: Зачет
A36: 28 | B36: Раскатов Андрей Владимирович | C36: 8 | D36: 0 | E36: 5.4545454545454541 | F36: 25 | G36: 0 | H36: 0 | I36: 30.454545454545453 | J36: А | K36: 15.3 | L36: 45.75454545454545 | M36: Неатест. | O36: =I36 -> 30.454545454545453 | P36: 14 | R36: - | U36: Неатест.
A37: 29 | B37: Рассохин Юрий Анатольевич | C37: 14 | D37: 0 | E37: 9.545454545454545 | F37: 45.6 | G37: 0 | H37: 0 | I37: 55.145454545454548 | J37: А | K37: 23.1 | L37: 78.24545454545455 | M37: Зачет | O37: =I37 -> 55.145454545454548 | Q37: - | R37: - | U37: Зачет
A38: 30 | B38: Саргин Максим Александрович | C38: 14 | D38: 0 | E38: 9.545454545454545 | F38: 25 | G38: 0 | H38: 8 | I38: 42.545454545454547 | J38: А | K38: 19.5 | L38: 62.045454545454547 | M38: Незачет | O38: =I38 -> 42.545454545454547 | Q38: - | R38: - | U38: Незачет
A39: 31 | B39: Саулин Павел Александрович | C39: 0 | D39: 0 | E39: 0 | F39: 0 | G39: 0 | H39: 0 | I39: 0 | J39: А | K39: 0 | L39: 0 | M39: Неатест. | O39: =I39 -> 0 | P39: 22 | R39: - | U39: Неатест.
A40: 32 | B40: Седов Анатолий Михайлович | C40: 17 | D40: 0 | E40: 11.59090909090909 | F40: 25 | G40: 0 | H40: 5 | I40: 41.590909090909093 | J40: А | K40: 31.2 | L40: 72.790909090909096 | M40: Незачет | O40: =I40 -> 41.590909090909093 | Q40: - | R40: - | U40: Незачет
A41: 33 | B41: Терехин Дмитрий Владимирович | C41: 17 | D41: 0 | E41: 11.59090909090909 | F41: 25 | G41: 0 | H41: 5 | I41: 41.590909090909093 | J41: А | K41: 24.9 | L41: 66.490909090909099 | M41: Незачет | O41: =I41 -> 41.590909090909093 | Q41: - | R41: - | U41: Незачет
A42: 34 | B42: Тимин Александр Николаевич | C42: 17 | D42: 0 | E42: 11.59090909090909 | F42: 48 | G42: 0 | H42: 5 | I42: 60 | J42: А | K42: 28.5 | L42: 88.5 | M42: Зачет | O42: =I42 -> 60 | Q42: - | R42: - | U42: Зачет
A43: 35 | B43: Шайдаков Алексей Дмитриевич | C43: 16 | D43: 0 | E43: 10.909090909090908 | F43: 0 | G43: 0 | H43: 6 | I43: 16.909090909090907 | J43: А | K43: 23.1 | L43: 40.009090909090908 | M43: Неатест. | O43: =I43 -> 16.909090909090907 | Q43: - | R43: - | U43: Неатест.
A44: 36 | B44: Шиманов Илья Константинович | C44: 6 | D44: 0 | E44: 4.0909090909090908 | F44: 0 | G44: 0 | H44: 0 | I44: 4.0909090909090908 | J44: А | K44: 0 | L44: 4.0909090909090908 | M44: Неатест. | O44: =I44 -> 4.0909090909090908 | P44: 16 | R44: - | U44: Неатест.
A45: 37 | B45: Ширшов Сергей Александрович | C45: 17 | D45: 0 | E45: 11.59090909090909 | F45: 22 | G45: 0 | H45: 11 | I45: 44.590909090909093 | J45: А | K45: 24.9 | L45: 69.490909090909099 | M45: Незачет | O45: =I45 -> 44.590909090909093 | Q45: - | R45: - | U45: Незачет