B1: Группа | C1: Р-4 | I1: Дата последней коррекции: | P1: 40284
B2: Предмет | C2: Системы Связи
B3: Вид отчетности | C3: Экзамен + курсовая | G3: Итоговый рейтинг
E6: 10 | F6: 20 | I6: max 60 | L6: max40 | O6: Экзамен + курсовая
C7: Текущий балл | J7: Автомат | P7: Вопросов | U7: Итоговая ОЦЕНКА
A8: № | B8: Ф.И.О. | C8: Лек. | D8: Курс. | E8: Блек | F8: Блаб | G8: Бкур | H8: Бдоп | I8: Бтек | J8: Авт | K8: Бавт | L8: ОБ(а) | M8: Оценка | O8: Бтек | P8: Доп | Q8: Отв | R8: Оценка | S8: Кол поп. | T8: ОБ
A9: 1 | B9: Казаков А.А. | C9: 17 | D9: 4 | E9: 15.9375 | F9: 23.5 | G9: 13 | H9: 5 | I9: 57.4375 | J9: А | K9: 34.8 | L9: 92.237499999999997 | M9: 4 Хор | O9: =I9 -> 57.4375 | Q9: - | R9: - | U9: 4 Хор
A10: 2 | B10: Казанцев В.М. | C10: 1 | D10: 0 | E10: 0.9375 | F10: 0 | G10: 0 | H10: 0 | I10: 0.9375 | J10: А | K10: 0 | L10: 0.9375 | M10: Неатест. | O10: =I10 -> 0.9375 | P10: 15 | R10: - | U10: Неатест.
A11: 3 | B11: Клюжев М.С. | C11: 11 | D11: 3 | E11: 10.3125 | F11: 20.5 | G11: 10 | H11: 0 | I11: 40.8125 | J11: A | K11: 14 | L11: 54.8125 | M11: 2 Неуд | O11: =I11 -> 40.8125 | Q11: - | R11: - | U11: 2 Неуд
A12: 4 | B12: Коршунов И.А. | C12: 14 | D12: 3 | E12: 13.125 | F12: 20.5 | G12: 10 | H12: 0 | I12: 43.625 | J12: А | K12: 34.8 | L12: 78.424999999999997 | M12: 3 Удовл | O12: =I12 -> 43.625 | Q12: - | R12: - | U12: 3 Удовл
A13: 5 | B13: Кудряшов С.П. | C13: 1 | D13: 0 | E13: 0.9375 | F13: 5 | G13: 0 | H13: 0 | I13: 5.9375 | J13: А | K13: 0 | L13: 5.9375 | M13: Неатест. | O13: =I13 -> 5.9375 | P13: 15 | R13: - | U13: Неатест.
A14: 6 | B14: Макарычев М.М. | C14: 11 | D14: 5 | E14: 10.3125 | F14: 23.5 | G14: 15 | H14: 0 | I14: 48.8125 | J14: А | K14: 28 | L14: 76.8125 | M14: 3 Удовл | O14: =I14 -> 48.8125 | Q14: - | R14: - | U14: 3 Удовл
A15: 7 | B15: Новичков А.С. | C15: 13 | D15: 0 | E15: 12.1875 | F15: 23.5 | G15: 0 | H15: 0 | I15: 35.6875 | J15: А | K15: 22.6 | L15: 58.287500000000001 | M15: Неатест. | O15: =I15 -> 35.6875 | Q15: - | R15: - | U15: Неатест.
A16: 8 | B16: Нозадзе Г.К. | C16: 12 | D16: 3 | E16: 11.25 | F16: 20.5 | G16: 10 | H16: 0 | I16: 41.75 | J16: А | K16: 20.8 | L16: 62.55 | M16: 2 Неуд | O16: =I16 -> 41.75 | Q16: - | R16: - | U16: 2 Неуд
A17: 9 | B17: Рябов А.А. | C17: 6 | D17: 0 | E17: 5.625 | F17: 15.5 | G17: 0 | H17: -6 | I17: 15.125 | J17: А | K17: 0 | L17: 15.125 | M17: Неатест. | O17: =I17 -> 15.125 | P17: 10 | R17: - | U17: Неатест.
A18: 10 | B18: Сидоров А.С. | C18: 17 | D18: 5 | E18: 15.9375 | F18: 23.5 | G18: 15 | H18: 5 | I18: 59.4375 | J18: А | K18: 33 | L18: 92.4375 | M18: 4 Хор | O18: =I18 -> 59.4375 | Q18: - | R18: - | U18: 4 Хор
A19: 11 | B19: Шибаев А.М. | C19: 7 | D19: 0 | E19: 6.5625 | F19: 20.5 | G19: 0 | H19: 0 | I19: 27.0625 | J19: А | K19: 28 | L19: 55.0625 | M19: Неатест. | O19: =I19 -> 27.0625 | P19: 9 | R19: - | U19: Неатест.
A20: 12 | C20: 0 | D20: 0 | E20: 0 | F20: 0 | G20: 0 | H20: 0 | I20: 0 | J20: А | K20: 0 | L20: 0 | M20: 0 | O20: =I20 -> 0
A21: 13 | B21: Березин П.Ю. | C21: 16 | D21: 0 | E21: 15 | F21: 23.5 | G21: 0 | H21: 3 | I21: 41.5 | J21: А | K21: 22.6 | L21: 64.1 | M21: Н/Д (курс) | O21: =I21 -> 41.5 | Q21: - | R21: - | U21: Н/Д (курс)
A22: 14 | B22: Бершов А.О. | C22: 11 | D22: 0 | E22: 10.3125 | F22: 20.5 | G22: 0 | H22: 0 | I22: 30.8125 | J22: А | K22: 8.6 | L22: 39.412500000000001 | M22: Неатест. | O22: =I22 -> 30.8125 | Q22: - | R22: - | U22: Неатест.
A23: 15 | B23: Болдин Л.О. | C23: 17 | D23: 0 | E23: 15.9375 | F23: 20.5 | G23: 0 | H23: 5 | I23: 41.4375 | J23: А | K23: 29.4 | L23: 70.837500000000006 | M23: Н/Д (курс) | O23: =I23 -> 41.4375 | Q23: - | R23: - | U23: Н/Д (курс)
A24: 16 | B24: Заболотный В.В. | C24: 16 | D24: 0 | E24: 15 | F24: 23.5 | G24: 0 | H24: 3 | I24: 41.5 | J24: А | K24: 40 | L24: 81.5 | M24: Н/Д (курс) | O24: =I24 -> 41.5 | Q24: - | R24: - | U24: Н/Д (курс)
A25: 17 | B25: Зуев А.А. | C25: 10 | D25: 0 | E25: 9.375 | F25: 5 | G25: 0 | H25: 0 | I25: 14.375 | J25: А | K25: 14 | L25: 28.375 | M25: Неатест. | O25: =I25 -> 14.375 | P25: 6 | R25: - | U25: Неатест.
A26: 18 | B26: Кабанин Д.В. | C26: 12 | D26: 0 | E26: 11.25 | F26: 20.5 | G26: 0 | H26: 0 | I26: 31.75 | J26: А | K26: 26.2 | L26: 57.95 | M26: Неатест. | O26: =I26 -> 31.75 | Q26: - | R26: - | U26: Неатест.
A27: 19 | B27: Кабанов Д.Г. | C27: 11 | D27: 0 | E27: 10.3125 | F27: 20.5 | G27: 0 | H27: 0 | I27: 30.8125 | J27: А | K27: 8.6 | L27: 39.412500000000001 | M27: Неатест. | O27: =I27 -> 30.8125 | Q27: - | R27: - | U27: Неатест.
A28: 20 | B28: Кокурин А.Н. | C28: 5 | D28: 0 | E28: 4.6875 | F28: 20.5 | G28: 0 | H28: -4 | I28: 21.1875 | J28: А | K28: 0 | L28: 21.1875 | M28: Неатест. | O28: =I28 -> 21.1875 | P28: 11 | R28: - | U28: Неатест.
A29: 21 | B29: Колпаков С.А. | C29: 16 | D29: 0 | E29: 15 | F29: 23.5 | G29: 0 | H29: 3 | I29: 41.5 | J29: А | K29: 36.6 | L29: 78.1 | M29: Н/Д (курс) | O29: =I29 -> 41.5 | Q29: - | R29: - | U29: Н/Д (курс)
A30: 22 | B30: Макаров А.Ю. | C30: 11 | D30: 0 | E30: 10.3125 | F30: 23.5 | G30: 0 | H30: 0 | I30: 33.8125 | J30: А | K30: 12.2 | L30: 46.012500000000003 | M30: Неатест. | O30: =I30 -> 33.8125 | Q30: - | R30: - | U30: Неатест.
A31: 23 | B31: Никулин О.Ю. | C31: 17 | D31: 0 | E31: 15.9375 | F31: 23.5 | G31: 0 | H31: 5 | I31: 44.4375 | J31: А | K31: 40 | L31: 84.4375 | M31: Н/Д (курс) | O31: =I31 -> 44.4375 | Q31: - | R31: - | U31: Н/Д (курс)
A32: 24 | B32: Овчинников О.И. | C32: 16 | D32: 0 | E32: 15 | F32: 23.5 | G32: 0 | H32: 3 | I32: 41.5 | J32: А | K32: 38.4 | L32: 79.9 | M32: Н/Д (курс) | O32: =I32 -> 41.5 | Q32: - | R32: - | U32: Н/Д (курс)
A33: 25 | B33: Пушкарев Д.В. | C33: 15 | D33: 0 | E33: 14.0625 | F33: 20.5 | G33: 0 | H33: 0 | I33: 34.5625 | J33: А | K33: 14 | L33: 48.5625 | M33: Неатест. | O33: =I33 -> 34.5625 | Q33: - | R33: - | U33: Неатест.
A34: 26 | B34: Шокин Д.А. | C34: 11 | D34: 0 | E34: 10.3125 | F34: 20.5 | G34: 0 | H34: 0 | I34: 30.8125 | J34: А | K34: 8.6 | L34: 39.412500000000001 | M34: Неатест. | O34: =I34 -> 30.8125 | Q34: - | R34: - | U34: Неатест.
A35: 27 | C35: 0 | D35: 0 | E35: 0 | F35: 0 | G35: 0 | H35: 0 | I35: 0 | J35: А | K35: 0 | L35: 0 | M35: 0 | O35: =I35 -> 0
A36: 28 | B36: Баринов А.Е. | C36: 13 | D36: 0 | E36: 12.1875 | F36: 5 | G36: 0 | H36: 0 | I36: 17.1875 | J36: А | K36: 12.2 | L36: 29.387499999999999 | M36: Неатест. | O36: =I36 -> 17.1875 | Q36: - | R36: - | U36: Неатест.
A37: 29 | B37: Волков А.В. | C37: 16 | D37: 0 | E37: 15 | F37: 10 | G37: 0 | H37: 3 | I37: 28 | J37: А | K37: 28 | L37: 56 | M37: Неатест. | O37: =I37 -> 28 | Q37: - | R37: - | U37: Неатест.
A38: 30 | B38: Гора Г.А. | C38: 12 | D38: 0 | E38: 11.25 | F38: 10 | G38: 0 | H38: 0 | I38: 21.25 | J38: А | K38: 20.8 | L38: 42.05 | M38: Неатест. | O38: =I38 -> 21.25 | Q38: - | R38: - | U38: Неатест.
A39: 31 | B39: Груздев С.М. | C39: 15 | D39: 0 | E39: 14.0625 | F39: 10 | G39: 0 | H39: 0 | I39: 24.0625 | J39: А | K39: 28 | L39: 52.0625 | M39: Неатест. | O39: =I39 -> 24.0625 | Q39: - | R39: - | U39: Неатест.
A40: 32 | B40: Дудин В.М. | C40: 13 | D40: 0 | E40: 12.1875 | F40: 10 | G40: 0 | H40: 0 | I40: 22.1875 | J40: А | K40: 8.6 | L40: 30.787500000000001 | M40: Неатест. | O40: =I40 -> 22.1875 | Q40: - | R40: - | U40: Неатест.
A41: 33 | B41: Кузичкин А.В. | C41: 15 | D41: 0 | E41: 14.0625 | F41: 5 | G41: 0 | H41: 0 | I41: 19.0625 | J41: А | K41: 26.2 | L41: 45.262500000000003 | M41: Неатест. | O41: =I41 -> 19.0625 | Q41: - | R41: - | U41: Неатест.
A42: 34 | B42: Отдельнов А.А. | C42: 17 | D42: 0 | E42: 15.9375 | F42: 5 | G42: 0 | H42: 5 | I42: 25.9375 | J42: А | K42: 22.6 | L42: 48.537500000000001 | M42: Неатест. | O42: =I42 -> 25.9375 | Q42: - | R42: - | U42: Неатест.
A43: 35 | B43: Рыбаков О.Ю. | C43: 10 | D43: 0 | E43: 9.375 | F43: 10 | G43: 0 | H43: 0 | I43: 19.375 | J43: А | K43: 24.4 | L43: 43.774999999999999 | M43: Неатест. | O43: =I43 -> 19.375 | P43: 6 | R43: - | U43: Неатест.
A44: 36 | B44: Шакиров И.А. | C44: 8 | D44: 0 | E44: 7.5 | F44: 10 | G44: 0 | H44: -3 | I44: 14.5 | J44: А | K44: 20.8 | L44: 35.3 | M44: Неатест. | O44: =I44 -> 14.5 | P44: 8 | R44: - | U44: Неатест.
A45: 37 | B45: Шибаев А.И. | C45: 9 | D45: 0 | E45: 8.4375 | F45: 5 | G45: 0 | H45: 0 | I45: 13.4375 | J45: А | K45: 17.2 | L45: 30.637499999999999 | M45: Неатест. | O45: =I45 -> 13.4375 | P45: 7 | R45: - | U45: Неатест.