B1: Группа | C1: Р-31 | I1: Дата последней коррекции: | P1: 40273
B2: Предмет | C2: РТЦ и С
B3: Вид отчетности | C3: Экзамен + курсовая | G3: Итоговый рейтинг
E6: 10 | F6: 30 | I6: max 60 | L6: max40 | O6: Экзамен + курсовая
C7: Текущий балл | J7: Автомат | P7: Вопросов | U7: Итоговая ОЦЕНКА
A8: № | B8: Ф.И.О. | C8: Лек. | D8: Курс. | E8: Блек | F8: Блаб | G8: Бкур | H8: Бдоп | I8: Бтек | J8: Авт | K8: Бавт | L8: ОБ(а) | M8: Оценка | O8: Бтек | P8: Доп | Q8: Отв | R8: Оценка | S8: Кол поп. | T8: ОБ
A9: 1 | B9: Ангелов Максим Алексеевич | C9: 14 | D9: 0 | E9: 12.352941176470587 | F9: 0 | G9: 0 | H9: 0 | I9: 12.352941176470587 | J9: А | K9: 0 | L9: 12.352941176470587 | M9: 0 | O9: =I9 -> 12.352941176470587 | Q9: -
A10: 2 | B10: Дубинов Владислав Сергеевич | C10: 14 | D10: 0 | E10: 12.352941176470587 | F10: 0 | G10: 0 | H10: 0 | I10: 12.352941176470587 | J10: А | K10: 0 | L10: 12.352941176470587 | M10: 0 | O10: =I10 -> 12.352941176470587 | Q10: -
A11: 3 | B11: Зайцев Антон Николаевич | C11: 11 | D11: 0 | E11: 9.7058823529411757 | F11: 0 | G11: 0 | H11: 0 | I11: 9.7058823529411757 | J11: А | K11: 0 | L11: 9.7058823529411757 | M11: 0 | O11: =I11 -> 9.7058823529411757 | P11: 6
A12: 4 | B12: Казаков Дмитрий Сергеевич | C12: 13 | D12: 0 | E12: 11.470588235294118 | F12: 0 | G12: 0 | H12: 0 | I12: 11.470588235294118 | J12: А | K12: 0 | L12: 11.470588235294118 | M12: 0 | O12: =I12 -> 11.470588235294118 | Q12: -
A13: 5 | B13: Коробов Никита Алексеевич | C13: 10 | D13: 0 | E13: 8.8235294117647065 | F13: 0 | G13: 0 | H13: 0 | I13: 8.8235294117647065 | J13: А | K13: 0 | L13: 8.8235294117647065 | M13: 0 | O13: =I13 -> 8.8235294117647065 | P13: 7
A14: 6 | B14: Краснощеков Илья Вячеславович | C14: 10 | D14: 0 | E14: 8.8235294117647065 | F14: 0 | G14: 0 | H14: 0 | I14: 8.8235294117647065 | J14: А | K14: 0 | L14: 8.8235294117647065 | M14: 0 | O14: =I14 -> 8.8235294117647065 | P14: 7
A15: 7 | B15: Малышев Алексей Александрович | C15: 12 | D15: 0 | E15: 10.588235294117647 | F15: 0 | G15: 0 | H15: 0 | I15: 10.588235294117647 | J15: А | K15: 0 | L15: 10.588235294117647 | M15: 0 | O15: =I15 -> 10.588235294117647 | Q15: -
A16: 8 | B16: Соловьев Дмитрий Сергеевич | C16: 12 | D16: 0 | E16: 10.588235294117647 | F16: 0 | G16: 0 | H16: 0 | I16: 10.588235294117647 | J16: А | K16: 0 | L16: 10.588235294117647 | M16: 0 | O16: =I16 -> 10.588235294117647 | Q16: -
A17: 9 | B17: Соловьев Иван Сергеевич | C17: 12 | D17: 0 | E17: 10.588235294117647 | F17: 0 | G17: 0 | H17: 0 | I17: 10.588235294117647 | J17: А | K17: 0 | L17: 10.588235294117647 | M17: 0 | O17: =I17 -> 10.588235294117647 | Q17: -
A18: 10 | B18: Суродеев Кирилл Олегович | C18: 11 | D18: 0 | E18: 9.7058823529411757 | F18: 0 | G18: 0 | H18: 0 | I18: 9.7058823529411757 | J18: А | K18: 0 | L18: 9.7058823529411757 | M18: 0 | O18: =I18 -> 9.7058823529411757 | P18: 6
A19: 11 | B19: Удалов Илья Александрович | C19: 12 | D19: 0 | E19: 10.588235294117647 | F19: 0 | G19: 0 | H19: 0 | I19: 10.588235294117647 | J19: А | K19: 0 | L19: 10.588235294117647 | M19: 0 | O19: =I19 -> 10.588235294117647 | Q19: -
A20: 12 | B20: Хазов Кирилл Алексеевич | C20: 13 | D20: 0 | E20: 11.470588235294118 | F20: 0 | G20: 0 | H20: 0 | I20: 11.470588235294118 | J20: А | K20: 0 | L20: 11.470588235294118 | M20: 0 | O20: =I20 -> 11.470588235294118 | Q20: -
A21: 13 | B21: Александров Евгений Владимирович | C21: 11 | D21: 0 | E21: 9.7058823529411757 | F21: 0 | G21: 0 | H21: 0 | I21: 9.7058823529411757 | J21: А | K21: 0 | L21: 9.7058823529411757 | M21: 0 | O21: =I21 -> 9.7058823529411757 | P21: 6
A22: 14 | B22: Аминов Алексей Рустемович | C22: 11 | D22: 0 | E22: 9.7058823529411757 | F22: 8.1 | G22: 0 | H22: 0 | I22: 17.805882352941175 | J22: А | K22: 0 | L22: 17.805882352941175 | M22: 0 | O22: =I22 -> 17.805882352941175 | P22: 6
A23: 15 | B23: Деев Владимир Эдуардович | C23: 14 | D23: 0 | E23: 12.352941176470587 | F23: 18 | G23: 0 | H23: 0 | I23: 30.352941176470587 | J23: А | K23: 0 | L23: 30.352941176470587 | M23: 0 | O23: =I23 -> 30.352941176470587 | Q23: -
A24: 16 | B24: Забеднов Денис Игоревич | C24: 12 | D24: 0 | E24: 10.588235294117647 | F24: 0 | G24: 0 | H24: 0 | I24: 10.588235294117647 | J24: А | K24: 0 | L24: 10.588235294117647 | M24: 0 | O24: =I24 -> 10.588235294117647 | Q24: -
A25: 17 | B25: Коннов Эдуард Алексеевич | C25: 11 | D25: 0 | E25: 9.7058823529411757 | F25: 0 | G25: 0 | H25: 0 | I25: 9.7058823529411757 | J25: А | K25: 0 | L25: 9.7058823529411757 | M25: 0 | O25: =I25 -> 9.7058823529411757 | P25: 6
A26: 18 | B26: Крашенинников Николай Александрович | C26: 14 | D26: 0 | E26: 12.352941176470587 | F26: 0 | G26: 0 | H26: 0 | I26: 12.352941176470587 | J26: А | K26: 0 | L26: 12.352941176470587 | M26: 0 | O26: =I26 -> 12.352941176470587 | Q26: -
A27: 19 | B27: Крисламов Александр Евгеньевич | C27: 13 | D27: 0 | E27: 11.470588235294118 | F27: 0 | G27: 0 | H27: 0 | I27: 11.470588235294118 | J27: А | K27: 0 | L27: 11.470588235294118 | M27: 0 | O27: =I27 -> 11.470588235294118 | Q27: -
A28: 20 | B28: Муняев Артем Андреевич | C28: 12 | D28: 0 | E28: 10.588235294117647 | F28: 0 | G28: 0 | H28: 0 | I28: 10.588235294117647 | J28: А | K28: 0 | L28: 10.588235294117647 | M28: 0 | O28: =I28 -> 10.588235294117647 | Q28: -
A29: 21 | B29: Пальгуев Сергей Юрьевич | C29: 3 | D29: 0 | E29: 2.6470588235294117 | F29: 0 | G29: 0 | H29: 0 | I29: 2.6470588235294117 | J29: А | K29: 0 | L29: 2.6470588235294117 | M29: 0 | O29: =I29 -> 2.6470588235294117 | P29: 14
A30: 22 | B30: Смолин Андрей Владимирович | C30: 3 | D30: 0 | E30: 2.6470588235294117 | F30: 0 | G30: 0 | H30: 0 | I30: 2.6470588235294117 | J30: А | K30: 0 | L30: 2.6470588235294117 | M30: 0 | O30: =I30 -> 2.6470588235294117 | P30: 14
A31: 23 | B31: Староверов Дмитрий Сергеевич | C31: 14 | D31: 0 | E31: 12.352941176470587 | F31: 18 | G31: 0 | H31: 0 | I31: 30.352941176470587 | J31: А | K31: 0 | L31: 30.352941176470587 | M31: 0 | O31: =I31 -> 30.352941176470587 | Q31: -
A32: 24 | B32: Сундеев Игорь Алексеевич | C32: 5 | D32: 0 | E32: 4.4117647058823533 | F32: 0 | G32: 0 | H32: 0 | I32: 4.4117647058823533 | J32: А | K32: 0 | L32: 4.4117647058823533 | M32: 0 | O32: =I32 -> 4.4117647058823533 | P32: 12
A33: 25 | B33: Французов Илья Владимирович | C33: 9 | D33: 0 | E33: 7.9411764705882355 | F33: 0 | G33: 0 | H33: 0 | I33: 7.9411764705882355 | J33: А | K33: 0 | L33: 7.9411764705882355 | M33: 0 | O33: =I33 -> 7.9411764705882355 | P33: 8
A34: 26 | C34: 0 | D34: 0 | E34: 0 | F34: 0 | G34: 0 | H34: 0 | I34: 0 | J34: А | K34: 0 | L34: 0 | M34: 0 | O34: =I34 -> 0