B1: Группа | C1: Р-4 | I1: Дата последней коррекции: | P1: 40284
B2: Предмет | C2: РНС
B3: Вид отчетности | C3: Зачет | G3: Итоговый рейтинг
E6: 11 | F6: 30 | I6: max 60 | L6: max40 | O6: Зачет
C7: Текущий балл | J7: Автомат | P7: Вопросов | U7: Итоговая ОЦЕНКА
A8: № | B8: Ф.И.О. | C8: Лек. | D8: Курс. | E8: Блек | F8: Блаб | G8: Бкур | H8: Бдоп | I8: Бтек | J8: Авт | K8: Бавт | L8: ОБ(а) | M8: Оценка | O8: Бтек | P8: Доп | Q8: Отв | R8: Оценка | S8: Кол поп. | T8: ОБ
A9: 1 | B9: Казаков А.А. | C9: 14 | D9: 0 | E9: 14 | F9: 40.8 | G9: 0 | H9: 0 | I9: 54.8 | J9: А | K9: ??? | L9: 54.8 | M9: Н/Д(конт) | O9: =I9 -> 54.8 | Q9: - | R9: - | U9: Н/Д(конт)
A10: 2 | B10: Казанцев В.М. | C10: 5 | D10: 0 | E10: 5 | F10: 0 | G10: 0 | H10: 0 | I10: 5 | J10: А | K10: 0 | L10: 5 | M10: Неатест. | O10: =I10 -> 5 | P10: 10 | R10: - | U10: Неатест.
A11: 3 | B11: Клюжев М.С. | C11: 11 | D11: 0 | E11: 11 | F11: 35.4 | G11: 0 | H11: 0 | I11: 46.4 | J11: А | K11: ??? | L11: 46.4 | M11: Н/Д(конт) | O11: =I11 -> 46.4 | Q11: - | R11: - | U11: Н/Д(конт)
A12: 4 | B12: Коршунов И.А. | C12: 14 | D12: 0 | E12: 14 | F12: 35.4 | G12: 0 | H12: 0 | I12: 49.4 | J12: А | K12: ??? | L12: 49.4 | M12: Н/Д(конт) | O12: =I12 -> 49.4 | Q12: - | R12: - | U12: Н/Д(конт)
A13: 5 | B13: Кудряшов С.П. | C13: 4 | D13: 0 | E13: 4 | F13: 0 | G13: 0 | H13: -5 | I13: -1 | J13: А | K13: 0 | L13: -1 | M13: Неатест. | O13: =I13 -> -1 | P13: 11 | R13: - | U13: Неатест.
A14: 6 | B14: Марычев М.М. | C14: 14 | D14: 0 | E14: 14 | F14: 39 | G14: 0 | H14: 0 | I14: 53 | J14: А | K14: ??? | L14: 53 | M14: Н/Д(конт) | O14: =I14 -> 53 | Q14: - | R14: - | U14: Н/Д(конт)
A15: 7 | B15: Новичков А.С. | C15: 14 | D15: 0 | E15: 14 | F15: 37.8 | G15: 0 | H15: 0 | I15: 51.8 | J15: А | K15: ??? | L15: 51.8 | M15: Н/Д(конт) | O15: =I15 -> 51.8 | Q15: - | R15: - | U15: Н/Д(конт)
A16: 8 | B16: Нозадзе Г.К. | C16: 13 | D16: 0 | E16: 13 | F16: 31 | G16: 0 | H16: 0 | I16: 44 | J16: А | K16: ??? | L16: 44 | M16: Н/Д(конт) | O16: =I16 -> 44 | Q16: - | R16: - | U16: Н/Д(конт)
A17: 9 | B17: Рябов А.А. | C17: 12 | D17: 0 | E17: 12 | F17: 4.4 | G17: 0 | H17: 0 | I17: 16.4 | J17: А | K17: ??? | L17: 16.4 | M17: Неатест. | O17: =I17 -> 16.4 | Q17: - | R17: - | U17: Неатест.
A18: 10 | B18: Сидоров А.С. | C18: 13 | D18: 0 | E18: 13 | F18: 37.8 | G18: 0 | H18: 0 | I18: 50.8 | J18: А | K18: 35.5 | L18: 86.3 | M18: Зачет | O18: =I18 -> 50.8 | Q18: - | R18: - | U18: Зачет
A19: 11 | B19: Шибаев А.М. | C19: 11 | D19: 0 | E19: 11 | F19: 43.2 | G19: 0 | H19: -7 | I19: 47.2 | J19: А | K19: ??? | L19: 47.2 | M19: Н/Д(конт) | O19: =I19 -> 47.2 | Q19: - | R19: - | U19: Н/Д(конт)
A20: 12 | C20: 0 | D20: 0 | E20: 0 | F20: 0 | G20: 0 | H20: 0 | I20: 0 | J20: А | K20: 0 | L20: 0 | M20: 0 | O20: =I20 -> 0
A21: 13 | B21: Березин П.Ю. | C21: 15 | D21: 0 | E21: 15 | F21: 42.6 | G21: 0 | H21: 0 | I21: 57.6 | J21: А | K21: ??? | L21: 57.6 | M21: Н/Д(конт) | O21: =I21 -> 57.6 | Q21: - | R21: - | U21: Н/Д(конт)
A22: 14 | B22: Бершов А.О. | C22: 12 | D22: 0 | E22: 12 | F22: 23.4 | G22: 0 | H22: -5 | I22: 30.4 | J22: А | K22: ??? | L22: 30.4 | M22: Неатест. | O22: =I22 -> 30.4 | Q22: - | R22: - | U22: Неатест.
A23: 15 | B23: Болдин Л.О. | C23: 15 | D23: 0 | E23: 15 | F23: 42 | G23: 0 | H23: 0 | I23: 57 | J23: А | K23: ??? | L23: 57 | M23: Н/Д(конт) | O23: =I23 -> 57 | Q23: - | R23: - | U23: Н/Д(конт)
A24: 16 | B24: Заболотный В.В. | C24: 14 | D24: 0 | E24: 14 | F24: 39 | G24: 0 | H24: 0 | I24: 53 | J24: А | K24: 26.5 | L24: 79.5 | M24: Зачет | O24: =I24 -> 53 | Q24: - | R24: - | U24: Зачет
A25: 17 | B25: Зуев А.А. | C25: 12 | D25: 0 | E25: 12 | F25: 24.6 | G25: 0 | H25: 0 | I25: 36.6 | J25: А | K25: ??? | L25: 36.6 | M25: Неатест. | O25: =I25 -> 36.6 | Q25: - | R25: - | U25: Неатест.
A26: 18 | B26: Кабанин Д.В. | C26: 12 | D26: 0 | E26: 12 | F26: 43.2 | G26: 0 | H26: 0 | I26: 55.2 | J26: А | K26: ??? | L26: 55.2 | M26: Н/Д(конт) | O26: =I26 -> 55.2 | Q26: - | R26: - | U26: Н/Д(конт)
A27: 19 | B27: Кабанов Д.Г. | C27: 11 | D27: 0 | E27: 11 | F27: 23.4 | G27: 0 | H27: -5 | I27: 29.4 | J27: А | K27: ??? | L27: 29.4 | M27: Неатест. | O27: =I27 -> 29.4 | Q27: - | R27: - | U27: Неатест.
A28: 20 | B28: Кокурин А.Н. | C28: 11 | D28: 0 | E28: 11 | F28: 39 | G28: 0 | H28: -11 | I28: 39 | J28: А | K28: ??? | L28: 39 | M28: Неатест. | O28: =I28 -> 39 | Q28: - | R28: - | U28: Неатест.
A29: 21 | B29: Колпаков С.А. | C29: 15 | D29: 0 | E29: 15 | F29: 41.4 | G29: 0 | H29: 0 | I29: 56.4 | J29: А | K29: 35.5 | L29: 91.9 | M29: Зачет | O29: =I29 -> 56.4 | Q29: - | R29: - | U29: Зачет
A30: 22 | B30: Макаров А.Ю. | C30: 14 | D30: 0 | E30: 14 | F30: 21.2 | G30: 0 | H30: 0 | I30: 35.2 | J30: А | K30: ??? | L30: 35.2 | M30: Неатест. | O30: =I30 -> 35.2 | Q30: - | R30: - | U30: Неатест.
A31: 23 | B31: Никулин О.Ю. | C31: 15 | D31: 0 | E31: 15 | F31: 41.4 | G31: 0 | H31: 0 | I31: 56.4 | J31: А | K31: 40 | L31: 96.4 | M31: Зачет | O31: =I31 -> 56.4 | Q31: - | R31: - | U31: Зачет
A32: 24 | B32: Овчинников О.И. | C32: 15 | D32: 0 | E32: 15 | F32: 39.6 | G32: 0 | H32: 0 | I32: 54.6 | J32: А | K32: ??? | L32: 54.6 | M32: Н/Д(конт) | O32: =I32 -> 54.6 | Q32: - | R32: - | U32: Н/Д(конт)
A33: 25 | B33: Пушкарев Д.В. | C33: 15 | D33: 0 | E33: 15 | F33: 43.8 | G33: 0 | H33: 0 | I33: 58.8 | J33: А | K33: ??? | L33: 58.8 | M33: Н/Д(конт) | O33: =I33 -> 58.8 | Q33: - | R33: - | U33: Н/Д(конт)
A34: 26 | B34: Шокин Д.А. | C34: 14 | D34: 0 | E34: 14 | F34: 39 | G34: 0 | H34: 0 | I34: 53 | J34: А | K34: ??? | L34: 53 | M34: Н/Д(конт) | O34: =I34 -> 53 | Q34: - | R34: - | U34: Н/Д(конт)
A35: 27 | C35: 0 | D35: 0 | E35: 0 | F35: 0 | G35: 0 | H35: 0 | I35: 0 | J35: А | K35: 0 | L35: 0 | M35: 0 | O35: =I35 -> 0
A36: 28 | B36: Баринов А.Е. | C36: 14 | D36: 0 | E36: 14 | F36: 41.4 | G36: 0 | H36: 0 | I36: 55.4 | J36: А | K36: ??? | L36: 55.4 | M36: Н/Д(конт) | O36: =I36 -> 55.4 | Q36: - | R36: - | U36: Н/Д(конт)
A37: 29 | B37: Волков А.В. | C37: 13 | D37: 0 | E37: 13 | F37: 41.4 | G37: 0 | H37: 0 | I37: 54.4 | J37: А | K37: 26.5 | L37: 80.9 | M37: Зачет | O37: =I37 -> 54.4 | Q37: - | R37: - | U37: Зачет
A38: 30 | B38: Гора Г.А. | C38: 15 | D38: 0 | E38: 15 | F38: 39 | G38: 0 | H38: 0 | I38: 54 | J38: А | K38: ??? | L38: 54 | M38: Н/Д(конт) | O38: =I38 -> 54 | Q38: - | R38: - | U38: Н/Д(конт)
A39: 31 | B39: Груздев С.М. | C39: 14 | D39: 0 | E39: 14 | F39: 41.4 | G39: 0 | H39: 0 | I39: 55.4 | J39: А | K39: 40 | L39: 95.4 | M39: Зачет | O39: =I39 -> 55.4 | Q39: - | R39: - | U39: Зачет
A40: 32 | B40: Дудин В.М. | C40: 13 | D40: 0 | E40: 13 | F40: 21 | G40: 0 | H40: -5 | I40: 29 | J40: А | K40: ??? | L40: 29 | M40: Неатест. | O40: =I40 -> 29 | Q40: - | R40: - | U40: Неатест.
A41: 33 | B41: Кузичкин А.В. | C41: 14 | D41: 0 | E41: 14 | F41: 37.8 | G41: 0 | H41: 0 | I41: 51.8 | J41: А | K41: ??? | L41: 51.8 | M41: Н/Д(конт) | O41: =I41 -> 51.8 | Q41: - | R41: - | U41: Н/Д(конт)
A42: 34 | B42: Отдельнов А.А. | C42: 14 | D42: 0 | E42: 14 | F42: 40.8 | G42: 0 | H42: 0 | I42: 54.8 | J42: А | K42: ??? | L42: 54.8 | M42: Н/Д(конт) | O42: =I42 -> 54.8 | Q42: - | R42: - | U42: Н/Д(конт)
A43: 35 | B43: Рыбаков О.Ю. | C43: 12 | D43: 0 | E43: 12 | F43: 39 | G43: 0 | H43: -5 | I43: 46 | J43: А | K43: ??? | L43: 46 | M43: Н/Д(конт) | O43: =I43 -> 46 | Q43: - | R43: - | U43: Н/Д(конт)
A44: 36 | B44: Шакиров И.А. | C44: 13 | D44: 0 | E44: 13 | F44: 24.6 | G44: 0 | H44: -5 | I44: 32.6 | J44: А | K44: ??? | L44: 32.6 | M44: Неатест. | O44: =I44 -> 32.6 | Q44: - | R44: - | U44: Неатест.
A45: 37 | B45: Шибаев А.И. | C45: 13 | D45: 0 | E45: 13 | F45: 21 | G45: 0 | H45: 0 | I45: 34 | J45: А | K45: ??? | L45: 34 | M45: Неатест. | O45: =I45 -> 34 | Q45: - | R45: - | U45: Неатест.