B1: Группа | C1: ЭМ-41 | I1: Дата последней коррекции: | P1: 40284
B2: Предмет | C2: МСУ
B3: Вид отчетности | C3: Экзамен + курсовая | G3: Итоговый рейтинг
E6: 6 | F6: 27 | I6: max 60 | L6: max40 | O6: Экзамен + курсовая
C7: Текущий балл | J7: Автомат | P7: Вопросов | U7: Итоговая ОЦЕНКА
A8: № | B8: Ф.И.О. | C8: Лек. | D8: Курс. | E8: Блек | F8: Блаб | G8: Бкур | H8: Бдоп | I8: Бтек | J8: Авт | K8: Бавт | L8: ОБ(а) | M8: Оценка | O8: Бтек | P8: Доп | Q8: Отв | R8: Оценка | S8: Кол поп. | T8: ОБ
A9: 1 | B9: Волков О.К. | C9: 10 | D9: 0 | E9: 10.714285714285714 | F9: 15.6 | G9: 0 | H9: 0 | I9: 26.314285714285713 | J9: А | K9: 0 | L9: 26.314285714285713 | M9: 0 | O9: =I9 -> 26.314285714285713 | Q9: - | R9: - | U9: Неатест.
A10: 2 | B10: Захаров Н.К. | C10: 13 | D10: 0 | E10: 13.928571428571429 | F10: 29 | G10: 0 | H10: 0 | I10: 42.928571428571431 | J10: А | K10: 22.3 | L10: 65.228571428571428 | M10: 0 | O10: =I10 -> 42.928571428571431 | Q10: - | R10: - | U10: Н/Д (курс)
A11: 3 | B11: Исаков В.А. | C11: 1 | D11: 0 | E11: 1.0714285714285714 | F11: 0 | G11: 0 | H11: 0 | I11: 1.0714285714285714 | J11: А | K11: 0 | L11: 1.0714285714285714 | M11: 0 | O11: =I11 -> 1.0714285714285714 | P11: 13 | R11: - | U11: Неатест.
A12: 4 | B12: Коновалов И.С. | C12: 10 | D12: 0 | E12: 10.714285714285714 | F12: 18 | G12: 0 | H12: 0 | I12: 28.714285714285715 | J12: А | K12: 7.3 | L12: 36.014285714285712 | M12: 0 | O12: =I12 -> 28.714285714285715 | Q12: - | R12: - | U12: Неатест.
A13: 5 | B13: Макаев А.С. | C13: 10 | D13: 0 | E13: 10.714285714285714 | F13: 41.4 | G13: 0 | H13: 0 | I13: 52.114285714285714 | J13: А | K13: 24.1 | L13: 76.214285714285722 | M13: 0 | O13: =I13 -> 52.114285714285714 | Q13: - | R13: - | U13: Н/Д (курс)
A14: 6 | B14: Макаров Р.И. | C14: 14 | D14: 0 | E14: 15 | F14: 15.6 | G14: 0 | H14: 0 | I14: 30.6 | J14: А | K14: 20.5 | L14: 51.1 | M14: 0 | O14: =I14 -> 30.6 | Q14: - | R14: - | U14: Неатест.
A15: 7 | B15: Мигунов А.Н. | C15: 6 | D15: 0 | E15: 6.4285714285714288 | F15: 10.4 | G15: 0 | H15: 0 | I15: 16.828571428571429 | J15: А | K15: 16.9 | L15: 33.728571428571428 | M15: 0 | O15: =I15 -> 16.828571428571429 | Q15: - | R15: - | U15: Неатест.
A16: 8 | B16: Никулин А.Е. | C16: 7 | D16: 0 | E16: 7.5 | F16: 10.4 | G16: 0 | H16: 0 | I16: 17.9 | J16: А | K16: 0 | L16: 17.9 | M16: 0 | O16: =I16 -> 17.9 | Q16: - | R16: - | U16: Неатест.
A17: 9 | B17: Плахин С.Н. | C17: 11 | D17: 4 | E17: 11.785714285714285 | F17: 38.4 | G17: 8.2 | H17: 0 | I17: 58.385714285714286 | J17: А | K17: 31.9 | L17: 90.285714285714278 | M17: 0 | O17: =I17 -> 58.385714285714286 | Q17: - | R17: - | U17: 4 Хор
A18: 10 | B18: Поздеев Р.А. | C18: 7 | D18: 0 | E18: 7.5 | F18: 13.4 | G18: 0 | H18: 0 | I18: 20.9 | J18: А | K18: 9.1 | L18: 30 | M18: 0 | O18: =I18 -> 20.9 | Q18: - | R18: - | U18: Неатест.
A19: 11 | B19: Разуванов М.Е. | C19: 2 | D19: 0 | E19: 2.1428571428571428 | F19: 11.6 | G19: 0 | H19: 0 | I19: 13.742857142857142 | J19: А | K19: 10 | L19: 23.74285714285714 | M19: 0 | O19: =I19 -> 13.742857142857142 | P19: 12 | R19: - | U19: Неатест.
A20: 12 | B20: Рыбин М.П. | C20: 12 | D20: 0 | E20: 12.857142857142858 | F20: 11.6 | G20: 0 | H20: 0 | I20: 24.457142857142856 | J20: А | K20: 9.6 | L20: 34.057142857142857 | M20: 0 | O20: =I20 -> 24.457142857142856 | Q20: - | R20: - | U20: Неатест.
A21: 13 | B21: Рыжов М.А. | C21: 0 | D21: 0 | E21: 0 | F21: 0 | G21: 0 | H21: 0 | I21: 0 | J21: А | K21: 0 | L21: 0 | M21: 0 | O21: =I21 -> 0 | P21: 14 | R21: - | U21: Неатест.
A22: 14 | B22: Рябинкин Д.О. | C22: 11 | D22: 0 | E22: 11.785714285714285 | F22: 15.6 | G22: 0 | H22: 0 | I22: 27.385714285714286 | J22: А | K22: 15 | L22: 42.385714285714286 | M22: 0 | O22: =I22 -> 27.385714285714286 | Q22: - | R22: - | U22: Неатест.
A23: 15 | B23: Рязанцев А.Ю. | C23: 11 | D23: 0 | E23: 11.785714285714285 | F23: 23.8 | G23: 0 | H23: 0 | I23: 35.585714285714289 | J23: А | K23: 0 | L23: 35.585714285714289 | M23: 0 | O23: =I23 -> 35.585714285714289 | Q23: - | R23: - | U23: Неатест.
A24: 16 | B24: Сонин С.А. | C24: 0 | D24: 0 | E24: 0 | F24: 0 | G24: 0 | H24: 0 | I24: 0 | J24: А | K24: 0 | L24: 0 | M24: 0 | O24: =I24 -> 0 | P24: 14 | R24: - | U24: Неатест.
A25: 17 | C25: 0 | D25: 0 | E25: 0 | F25: 0 | G25: 0 | H25: 0 | I25: 0 | J25: А | K25: 0 | L25: 0 | M25: 0 | O25: =I25 -> 0
A26: 18 | B26: Бородавин Ю.В. | C26: 11 | D26: 0 | E26: 11.785714285714285 | F26: 25 | G26: 0 | H26: 0 | I26: 36.785714285714285 | J26: А | K26: 38.2 | L26: 74.985714285714295 | M26: 0 | O26: =I26 -> 36.785714285714285 | Q26: - | R26: - | U26: Неатест.
A27: 19 | B27: Бородин А.В. | C27: 13 | D27: 0 | E27: 13.928571428571429 | F27: 21 | G27: 0 | H27: 0 | I27: 34.928571428571431 | J27: А | K27: 23.2 | L27: 58.128571428571433 | M27: 0 | O27: =I27 -> 34.928571428571431 | Q27: - | R27: - | U27: Неатест.
A28: 20 | B28: Воронцов С.М. | C28: 10 | D28: 0 | E28: 10.714285714285714 | F28: 37.8 | G28: 0 | H28: 0 | I28: 48.514285714285712 | J28: А | K28: 7.3 | L28: 55.81428571428571 | M28: 0 | O28: =I28 -> 48.514285714285712 | Q28: - | R28: - | U28: Н/Д (курс)
A29: 21 | B29: Дробилов А.В. | C29: 10 | D29: 0 | E29: 10.714285714285714 | F29: 16.8 | G29: 0 | H29: 0 | I29: 27.514285714285712 | J29: А | K29: 9.6 | L29: 37.114285714285714 | M29: 0 | O29: =I29 -> 27.514285714285712 | Q29: - | R29: - | U29: Неатест.
A30: 22 | B30: Егоров Д.В. | C30: 11 | D30: 0 | E30: 11.785714285714285 | F30: 13.4 | G30: 0 | H30: 0 | I30: 25.185714285714283 | J30: А | K30: 0 | L30: 25.185714285714283 | M30: 0 | O30: =I30 -> 25.185714285714283 | Q30: - | R30: - | U30: Неатест.
A31: 23 | B31: Жуков Р.Е. | C31: 0 | D31: 0 | E31: 0 | F31: 0 | G31: 0 | H31: 0 | I31: 0 | J31: А | K31: 0 | L31: 0 | M31: 0 | O31: =I31 -> 0 | P31: 14 | R31: - | U31: Неатест.
A32: 24 | B32: Кибирев А.А. | C32: 6 | D32: 0 | E32: 6.4285714285714288 | F32: 18 | G32: 0 | H32: 0 | I32: 24.428571428571431 | J32: А | K32: 16.9 | L32: 41.328571428571429 | M32: 0 | O32: =I32 -> 24.428571428571431 | Q32: - | R32: - | U32: Неатест.
A33: 25 | B33: Ковалев О.А. | C33: 1 | D33: 0 | E33: 1.0714285714285714 | F33: 11.6 | G33: 0 | H33: 0 | I33: 12.671428571428571 | J33: А | K33: 0 | L33: 12.671428571428571 | M33: 0 | O33: =I33 -> 12.671428571428571 | P33: 13 | R33: - | U33: Неатест.
A34: 26 | B34: Кожухов Е.А. | C34: 0 | D34: 0 | E34: 0 | F34: 0 | G34: 0 | H34: 0 | I34: 0 | J34: А | K34: 0 | L34: 0 | M34: 0 | O34: =I34 -> 0 | P34: 14 | R34: - | U34: Неатест.
A35: 27 | B35: Кочнев В.Н. | C35: 13 | D35: 0 | E35: 13.928571428571429 | F35: 32 | G35: 0 | H35: 0 | I35: 45.928571428571431 | J35: А | K35: 38.2 | L35: 84.128571428571433 | M35: 0 | O35: =I35 -> 45.928571428571431 | Q35: - | R35: - | U35: Н/Д (курс)
A36: 28 | B36: Полушков М.В. | C36: 11 | D36: 0 | E36: 11.785714285714285 | F36: 18 | G36: 0 | H36: 0 | I36: 29.785714285714285 | J36: А | K36: 9.1 | L36: 38.885714285714286 | M36: 0 | O36: =I36 -> 29.785714285714285 | Q36: - | R36: - | U36: Неатест.
A37: 29 | B37: Разухин А.И. | C37: 9 | D37: 0 | E37: 9.6428571428571423 | F37: 18 | G37: 0 | H37: 0 | I37: 27.642857142857142 | J37: А | K37: 0 | L37: 27.642857142857142 | M37: 0 | O37: =I37 -> 27.642857142857142 | Q37: - | R37: - | U37: Неатест.
A38: 30 | B38: Телицын Е.В. | C38: 10 | D38: 0 | E38: 10.714285714285714 | F38: 18 | G38: 0 | H38: 0 | I38: 28.714285714285715 | J38: А | K38: 0 | L38: 28.714285714285715 | M38: 0 | O38: =I38 -> 28.714285714285715 | Q38: - | R38: - | U38: Неатест.
A39: 31 | B39: Шалин А.Г. | C39: 0 | D39: 0 | E39: 0 | F39: 0 | G39: 0 | H39: 0 | I39: 0 | J39: А | K39: 0 | L39: 0 | M39: 0 | O39: =I39 -> 0 | P39: 14 | R39: - | U39: Неатест.
A40: 32 | B40: Ямщиков А.А. | C40: 12 | D40: 0 | E40: 12.857142857142858 | F40: 14 | G40: 0 | H40: 0 | I40: 26.857142857142858 | J40: А | K40: 40 | L40: 66.857142857142861 | M40: 0 | O40: =I40 -> 26.857142857142858 | Q40: - | R40: - | U40: Неатест.
A41: 33 | B41: Лапшин Сергей | C41: 3 | D41: 0 | E41: 3.2142857142857144 | F41: 0 | G41: 0 | H41: 0 | I41: 3.2142857142857144 | J41: А | K41: 0 | L41: 3.2142857142857144 | M41: 0 | O41: =I41 -> 3.2142857142857144 | P41: 11 | R41: - | U41: Неатест.
A42: 34 | C42: 0 | D42: 0 | E42: 0 | F42: 0 | G42: 0 | H42: 0 | I42: 0 | J42: А | K42: 0 | L42: 0 | M42: 0 | O42: =I42 -> 0